car,score,content
2026 기아 카니발 하이리무진,6.67,"렉서스 rx350 10년정도 타다가. 카니발로 넘어왔네요. 같은 v6 3500cc인데.. 주행하다보니 자꾸 비교가되네요. 일단.디자인은 좋아요. 거주성최고. 아이들링.상태나 저속 60-70km미만에선 아주조용하고 S클래스 느낌날정도로 좋더라구요 하지만 80km넘어가면서 노면(바닥소음)을 읽으면서 가는게 느끼지고.. 고속으로가면 10년넘은 렉서스 보다 시끄럽네요 그래도 첨단장비 탑제되어 주행이 편해요 신세계를 경험중입니다. 시내주행은 렉서스보다 좀 못나오는듯하며, 고속80km이상주행은 연비가 13정도 나와줘서 좋네요 엔진룸 열면 소음이.좀 나는편인데 실내에선 아주조용하네요. 10년넘은 렉서스는 엔진룸열어도 엔진소음이 조용한편이였.... 2025년식이라 최첨단장비를 몸소느끼며 즐겁게.타고있습니다. 이제 신차 900km주행했네요 ㅎㅎ 잔고장없이 이차도 렉서스처럼 10년넘게 탔으면 합니다."
2026 기아 카니발 하이리무진,9.33,연비는 cc 고려하면 나쁘지 않고 전체적으로 가족 차량으로 가성비 갑!
2026 애스턴마틴 DBX707,9.00,만족합니다 ♡♡ 멋진 디자인 넉넉한 공간 패밀리 카로서 아주 좋아요 ~~~~
2026 현대 아이오닉 5 N,8.67,"nf소나타 이후 독일차만 타다가 거의15년만에 현대차를 구입했는데 와…이건 제가 알던 현대차가 아니네요…;;일단 하체 차대 모두 짱짱한게 느껴집니다 제가 볼땐 독일차와 크게 차이가 안느껴집니다 솔직히 누가타더라도 독일차 턱밑까지 따라왔음을 부정할수 없을듯합니다 출력은 말할필요도 없이 넘칩니다 다만, 아직은 조립품질 및 도장퀄리티가 미흡한 부분이 있지만 가격이 용서해줍니다 실내거주성은 이미 옛날부터 현대가 잘하던거라 아쉬움 전혀없습니다 단점은 외장 하이그로시부분(트렁크 윗부분, 사이드몰딩부분)이 우글우글 거립니다 이거는 무슨 중국차같은 수준이네요…;; 장점99개가 단점1개에 다 뭍힐정도로 크리티컬한 품질불량인듯합니다 이거 빼곤 100점도 모자를만큼 훌륭합니다 주행거리가 다소 짧지만 출력이 다 커버해줍니다"
2026 현대 아이오닉 5 N,8.67,가격과 주행가능거리가 조금 짧다는 점을 제외하면 디자인부터 향상된 성능등 대부분 만족합니다.
2026 현대 아이오닉 5 N,9.67,이 가격에 이정도 퍼포먼스는 그 어떤 수입차를 가져와도 비빌 수가 없다.
2026 현대 아이오닉 5 N,9.00,패밀리카로 즐기는 최고의 펀카 하지만 모르는 사람이보면 아이오닉5 일반적인 주행에서는 일반전기차와 같고 600마력이상의차를 이정도의 유지비로 감당가능하다는게 말이안되긴함
2026 현대 아이오닉 5 N,8.00,"혼자 탈 때 기준 언제나 행복하고 즐거운 드라이빙이 가능한 마법의 차량이지만, 트레이드오프가 좀 있습니다. 가족이 같이 타도 공간 넓고 좋긴 하지만 태생적인 세팅 한계로 승차감이 좀 많이 딱딱하고, 타이어도 올시즌 갈게 아니면 서머타이어 마일리지도 짧은 데다 구하기도 어렵고 가격도 비싼 편입니다. 주행거리 한계도 있고요... 쉽게 말해 내연기관 고성능차에 드는 각종 경정비/오일류 교환비를 모두 타이어로 몰빵했다 보면 됩니다. 그래도 탈 때마다 즐겁고 5N 2세대 나올 때까지 계속 탈 거 같아요."
2026 현대 아이오닉 5 N,8.67,"주행가능 거리가 짧은것만 빼면 완벽에 가까운차량. 다만 외부에서 들리는 배기사운드가 작고, 다른 사운드도 추가되면 더 좋을듯"
2026 현대 아이오닉 5 N,8.83,"차량이 너무 무거움 600마력에맞는 브레이크 시스템을 채용하면서도 무거운 무게때문에 관성을 제어하기 쉽지않음, 차라리 휠사이즈를 20인치정도로 낮추었다면 타이어 선택폭이 넓어서 어느정도 허용할수있을텐데 21인치의 훨은 아쉽.."
2026 현대 아이오닉 5 N,8.00,1억 미만 최고의 펀카입니다. 거기에 압도적으로 저렴한 유지비는 덤이죠 1억미만에 육각형 자동차라고 봐도 무방하죠! 다만…현대스러운 품질은 아직도 아쉽습니다 영원히 잡히지 않는 트렁크 잡소리(블루핸즈 3회방문) 교체해도 끝이 없는 핸들 에어백 부분 가죽 눌림현상 (블루핸즈 3회 방문) 현대의 고질병인 웨더스트립 마찰음 (블루핸즈 1회 방문) 그럼에도 엑셀에 발을 올리면 입꼬리가 절로 올라가는 마법을 보여줍니다!
2026 현대 아이오닉 5 N,8.67,슈퍼 패밀리카! 디자인도 내 취향! 충전 한번 더 하더라도 5N의 가치는 먼저 누리는 자가 승자! 나의 첫 현대차인데 현대 감사합니다 소리가 절로 나오는 차!
2026 현대 아이오닉 5 N,9.33,때려밟아도 배터리 컨디션 유지하는차는 포르쉐랑 애밖에 없는듯 배터리 컨디셔닝 기술이 넘 우수함 뉘르 4바퀴 쌉가능
2026 현대 쏘나타 하이브리드,9.33,"비싸긴 하지만, 차량 가격이 전체적으로 올라서 그런거라고 생각함. 실내가 넓게 빠져서 차에 타고 있으면 매우 쾌적함. 차 산지 11개월 되었는데 아직까진 큰 불만 없이 타고 있음. 풀옵으로 사서 기능들 알뜰하게 써먹는중임. 이 중에 하나라도 없었으면 불편했을것 같음."
2026 현대 쏘나타 하이브리드,9.33,연비에 옵션의 편의성까지 최고입니다. 장거리 출퇴근용으로 최고입니다. 다만 노면소음이 좀 아쉽습니다.
2026 현대 쏘나타 하이브리드,8.67,하이브리드라서 그런지 확실하게 연비와 정속성이 좋습니다. 다만 가속도가 느리게 붙어서 스포티한 주행능력을 원하시는 분들은 속이 터질수 있습니다. 뭐 그런분들은 하이브리드 터보로 가시겠지요. 주행도 참 편안하고 좋습니다. 가격은 좀더 쌌으면하는 바람이 있네요
2026 현대 쏘나타 하이브리드,10.00,그랜저 가격이 부담스럽고 적당히 가성비가 뛰어난 차를 찾는 사람들에게 잘맞는 차입니다. 연비도 좋고 실내 공간도 좋아요. 내장도 신형이라 많이 좋아졌고 네비도 괜찮아요. 단점은 2.0hev 라서 1.6터보 hev 에 비해 출력이 떨어지고 세금이 비싸다는점.
2026 현대 쏘나타 하이브리드,9.00,전체적인 무난함 디자인도 무난 연비는 시내주행은 16-18나오고 시외가 20이상 나옴 하이브리드를 처음 타봐서 시내주행이 더 잘나온다고 들었는데 시외주행이 더 잘나왔음
2026 현대 쏘나타 하이브리드,8.67,11111111111111111111111111111111111111111
2026 현대 쏘나타 하이브리드,10.00,"예전 국민차의 명성은 이제 다 빼앗겼지만, 여전히 훌륭한 차입니다. 하이브리드의 연비가 너무 좋고 (23,000km 누적 20.9km/l), 4인 탑승시에도 좋은 가속력과 편안한 승차감이 있습니다. 실용성과 합리적 가격을 원하시는 분들이라면 추천합니다."
2026 현대 쏘나타 하이브리드,8.83,"노면소음 제외하고 정숙성 좋음, 이건 피렐리타이어라서 그런것같고, 토크가 약간 딸려서 고속에서 차선변경시 뒷차와 여유를 두고 천천히 해야하는 단점아닌 단점이 있음."
2026 현대 쏘나타 하이브리드,8.83,"세단을 좋아하는 사람으로서 쏘나타 디엣지가 출시된 이후부터 계속 구매하고 싶다는 마음이 있었습니다. 그러던 찰나에 결혼을 하게 되어 차를 바꾸게 됐는데, 가격대가 비슷한 SUV인 투싼과 고민하다가 결국 디자인과 연비 때문에 쏘나타를 선택하게 됐습니다. 하이브리드 차량은 처음 타보는데 생각보다 연비가 이전에 타던 K3보다 극적으로 좋지는 않아서 다소 실망했지만, 이 부분은 18인치 휠 때문인 것도 있고 타면 탈수록 연비도 점점 좋아지고 있어서 전반적으로 만족스럽습니다. 무엇보다도 실내 공간과 편의성 측면에서 딱히 흠잡을 데가 없고, 디자인은 개인적인 취향이지만 제 기준에서는 로보캅 형제들 중 가장 이쁘게 잘 빠진 것 같습니다. 주행 성능은 연비를 신경쓰지 않고 운전하면 밟는대로 잘 나가는 편이라고 느껴집니다."
2026 현대 쏘나타 하이브리드,10.00,"너무 훌륭한 자동차 입니다. 연비, 주행성능, 디자인 뭐하나 빠지는데 없는 6각형 자동차!"
2026 현대 쏘나타,9.00,그래도 이만한 차는 잘 없는 듯 !! 신차로 출고했는데 열심히 달려보겠습니닷
2026 현대 쏘나타,10.00,"너무 만족스럽게 타고 있습니다!! 실내, 실외 디자인 모두 마음에듭니다. 안전운전!"
2026 현대 쏘나타,10.00,최고의 차. 매우 만족하고 타고 있습니다. 연비도 좋고 디자인도 마음에 들어요.
2026 현대 쏘나타,10.00,디자인은 깔꺼없다 보구요. 이정도 가격대에 이정도 승차감이라 흠 훌륭합니다
2026 현대 쏘나타,9.67,구입한지 1년5개월 지났고16800km 넘어가고 있습니다. 10년만에 차를 구입하다보니 차가격이 많이 올라서 놀랬지만...지금 너무 만족하며 타고있습니다. 연비걱정 있었는데 지금까지 총 연비 15.6나오고 있습니다. 고속도로에서 스포츠모드로 밟으니 밟는대로 나가서 놀랬고 품질면에서는 하부에서 오는 소음이 생각보다 컸지만 음악들으며 가니 어느순간 무뎌지더라구요.
2026 현대 쏘나타,8.83,디자인이 너무 이뻐요. 옵션이 합리적이에요 연비도 나쁘지않아요 남들에게 추천할만해요
2026 현대 쏘나타,6.67,구매한지 이틀.. 디자인은 개취가 아니지만 실용적인 듯 해서 선택... LF소나타 처럼...나중에 좋은평가 받는 차량이었으면...하는 바램임... 생각보다...조용하진 않음....1.6터보엔진.... 구형SM이 더 조용하게 느껴졌던건...기분탓이려나..?!
2026 현대 쏘나타,6.83,에코모드는 거의 굼뚬 답답함 추월시 충분한 거리를두고 들어가야됨 저속시 바닥소음이 심함 언덕길은 힘겨워함 전반적으로 그닥 무난
2026 현대 쏘나타,9.83,1.6터보 고속도로 80키로 크루즈 켜면 연비 23나옴.. 가성비로는 너무 좋은차
2026 현대 쏘나타,8.00,좋다. 진짜로. 그냥하는 말이 아니라. 새차니까 당연히 좋을 수밖에 없나.
2026 기아 스포티지 하이브리드,9.00,구형에 비하면 확실히 좋아지고 특히 안전사양과 사용자 편의가 좋아졌다고 생각합니다. 다만 오른 가격을 보면 당연해야 하다못해 증액이 좀 과하다고 느껴지긴 합니다. 그래도 비싼거 빼곤 전부 맘에 들어요
2026 기아 스포티지 하이브리드,8.83,하이브리드 첨 타보는뎨. 주유소 갈일이 확실히 줄었어요 디자인 맘에들구요
2026 기아 스포티지 하이브리드,9.17,"쏘렌토 시그니처까지 했다가 와이프가 주차할때 너무 스트레스받아할것 같아서 스포티지로 바꿨고, 이왕에 줄이는거 가격도 대폭 줄이자 해서 하브프레스티지 스타일, 네비, 블박했는데 아주 만족함. 전동트렁크가 제일 아쉽긴 하지만 세이브한 천만원으로 SnP500 사놓고 지금은 뿌듯함. 일주일 168시간중, 많게는 4시간, 적게는 1시간정도 차를 타는거라서 저정도만 해도 훌륭함."
2026 기아 스포티지 하이브리드,10.00,연비 막해도 18이상은 나와서 좋네요 관리하면 20도 넘고 오토큐도 많아서 편합니다
2026 기아 스포티지 하이브리드,8.83,4개월차 하브 오너에요 전체적으로 만족해요 차량 가격이 좀 비싼거 말고는 다좋습니다
2026 기아 스포티지 하이브리드,8.33,"오늘 차량을 받아서 주행 후 평가하겠습니다 2026년형 스포티지 하이브리드, 드디어 내 손에! 🚗💨 앞으로 잘 부탁해요! 새로운 모험이 시작될 준비가 되어 있어요. 🌟 이제는 연비 걱정은 NO! 💚 가족과 함께하는 드라이브가 더 즐거워질 것 같아요. 😊 #스포티지 #하이브리드 #새차 #드라이브 #가족과함께 #차사랑 #모험시작 #연비짱"
2026 기아 스포티지 하이브리드,9.67,첫차로 실내외 넓게 빠지고 옵션이나 디자인이나 깔끔하고 좋은것 같아요. 초보가 운전하기 딱이네요 ㅋㅋ
2026 기아 스포티지 하이브리드,6.33,"차가격너무비싸요.. 공간성 싼타페가너무커서 바꾼건데 1-2인은 만족해요 센터페시아쪽 휴대폰 넣을공간이부족합니다. 무선충전패드는 너무뜨거워요 예전부터그랬지만 억지로 무선충전패드쪽 휴대폰에 수납할수밖에없음 차량시야좋아요, 자체가낮은느낌? 소재는 좀떨어지지만 내부인테리어 색상조합은 괜찮아서 싼느낌은잘안들어요 제기준 시그니처 풀옵 하나도안빠짐 4600정도 들은듯"
2026 기아 스포티지 하이브리드,10.00,차가 비싸긴 하지만 옛날 스포티지 옆에 있으면 크기가 게임도 안됩니다 차 처음받았을때 소렌토인줄 알았네요 아반떼 타다가 바꿔서 그런지 몰라도 차가 엄청 크고 조용합니다 풀옵 사길 잘했어요
2026 기아 스포티지 하이브리드,7.67,음 단점으로는 가격이 조금 안좋은거 같음!좀 비싸다??! 노면이 느껴진다??. 하지만 확실히 차는 좋은거같음 이번추석때 고속도로서 자율 주행등 장거리 이동할때 스마트크루즈 기능등 너무 편해서좋음 그리고 넓기도하고
2026 기아 스포티지,7.67,"디자인,성능, 편의성등 전반적으로 우수합니다, 쎄컨드차로 사용하기에 좋습니다"
2026 기아 스포티지,10.00,"첫 차로 샀는데, 탑승감 딱딱해서 좋고 가솔린 4륜 고속도로 연비 16 이상 나와서 좋음"
2026 기아 스포티지,9.00,"노말모드만 해도 반응좋고 너무 잘나감 프레 3옵인디 가성비 굿 차량 굉장히 크고 넓음 충분함! 울프그레이인데 유니크하고 너무 이쁨 연비는 시내주행하면 10정도, 고속 15정도 나와요"
2026 기아 스포티지,9.67,"차량 사전예약하고 운행 시작한지 11개월 곧..1년 되네요. 가솔린 1.6터보 시그니처 모델입니다. 매번 외제차 중고를 사고 팔다가 결혼 하면서 생에 처음 신차 구매한 차량입니다 개인생각에 좋은점. 내부 잡소리가 없다. 내부 조용함 예전 국산같은 터보 렉 같은건 안느껴짐. 미션이 변경 덕에 dct미션의 불쾌감 같은건 없음. 2열 넓음, 예전 스포티지 사이즈가 아니라 요즘은 차들이 예전 보다 한 체급 더 크게 만들어지는거 같음 자동차 키가 이쁨, 여러옵션들 다 유용함 의외로 디지털키 또한 유용함 HUD 기능 정보 맘에듬 개인적인 단점 2열 승차감 별로임, 8단 미션 거동이 부드럽긴하나 조금 바보임 밟으면 잘 나가는 느낌은 없음 출력대비 차량이 무거운느낌 처음 suv를 접하다보니 안정감은 세단이랑 확실한 차이가 있음 총평 이렇게 적다보니까 차량가격 대비 만족도가 높은차량 입니다."
2026 기아 스포티지,7.17,타면 탈수록 만족도가 높아짐. 가스비만 저렴하다면 연비 충분히 탈만함. 정체구간없는 장거리 운행이 많은 오너에겐 하이브리드 대체 충분함
2026 기아 스포티지,5.83,lpg 라 사람 많이 태우거나 오르막길 주행시 rpm을 많이 쓰는건 어쩔 수 없는것 같습니다. 또 연비도 안좋고 6단 미션은 별루~나름 조용해서 그건 만족 합니다.
2026 기아 스포티지,8.67,제가 뽑아서 그런게 아니라 현재 이만한 차가 있을까 합니다. 전 시그니처로 뽑았지만 프레스티지로 기본 스타일+네비+빌캠 조합도 가성비로 괜찮을듯 합니다.
2026 기아 스포티지,10.00,"예상보다 연비가 좋아요. 실내공간 넓고, 증강현실 내비는 그리 편하지는 않네요"
2026 기아 스포티지,9.00,가격대비 옵션을 좋습니다 승차감은 하드하지만 시내주행에서는 만족합니다. 가솔린 연비는 고속은 아주 훌륭합니다 그러나 시내주행에서는 생각보다 좋지않습니다
2026 기아 스포티지,9.33,"신형으로써 무난합니다만, 가성비는 좋은지 모르겠네요 옵션까지 포함하면 생각보다 가격대가 올라가서 잘 생각해봐야할 것 같습니다."
2026 메르세데스-벤츠 마이바흐 S클래스,9.67,잘 타고 있어요! 차 탔은 안할차니까요. 더 타봐야겠지만요 마지막으로 한 10년타려고 산차입니다
2026 메르세데스-벤츠 마이바흐 S클래스,5.67,잔 고장이 너무 많다. 서비스센터 자주가고 고질병들이 많음. 좋은점도 있지만 불편한 현실이 더 도움이 되길...
2026 메르세데스-벤츠 마이바흐 S클래스,,클린봇이 부적절한 표현을 감지한 댓글입니다.
2026 메르세데스-벤츠 마이바흐 S클래스,9.67,15년간 s클래스만 3대째 인 48세 입니다. 이번 세대 디자인은 맘에 안 들지만 여전히 일상용으로는 모든 부분에 만족합니다. 신경안고 탈 편안함으로는 비교할 대상이 없습니다.
2026 메르세데스-벤츠 마이바흐 S클래스,8.67,그냥 감성으로 타면 됩니다~ 이 가격대에 젊으시면 포르쉐 타이칸 가시거나 m850i gt43 정도?? 저는 유지비가 좀 저렴한 타이칸 추천드리고 나이대가 50대 이상이시면 1.5억에 프로모션 1000만정도 가져갈수있는 s350 추천드려요!! 연비는 좋습니다~ /엄청편하다 /이게 s클래스지 /에어서스펜션 /이런건 딱히 드라마틱하게 느끼지 못합니다~ 그냥 성공의 상징이자 감성으로 타는 차 같네요 ㅎㅎ.. ㅠ
2026 메르세데스-벤츠 마이바흐 S클래스,3.33,내인생에 최악의차 벤츠는 내인생에 없다 뒷자리 커튼고장 시트잡소리 전자장비 고장에 진짜 차가 이렇게 자주 고장날수있을까싶다 비싼 쓰래기래
2026 메르세데스-벤츠 마이바흐 S클래스,9.17,전체적으로 점잔고 부드럽고 딱 제 취향입니다 ᆢ 늘 만족하는 벤츠 s클래스 유저 입니다
2026 메르세데스-벤츠 마이바흐 S클래스,10.00,새차 뽑은지 얼마안되었는데 만족합니다 가성비 연비 훌륭합니다 정숙하고 승차감도 좋습니다
2026 메르세데스-벤츠 마이바흐 S클래스,9.17,코너 주행의 안정감 최고구요 전에 타던 다른 모든 차들과 비교해도 승차감과 장시간 운전시 편안함은 최고입니다. 편의 기능들도 다 너무 좋은데 한가지 불편한 점은 음성인식과 네비게이션이 현대차 블루링크에 비교하면 많이 떨어집니다. 연비는 마일드 하이브리드 덕분인지 고속도로 및 전용도로 운행을 주로 해서 8~9Km/l 정도 나오는것 같습니다. 현대 G90 과 비슷한 수준이요.
2026 메르세데스-벤츠 마이바흐 S클래스,8.00,"편안한 주행. 높은 연비. 하차감 굿. 에러는 아직까지 업ㄴ으나, 최근차량들 전자장비 많아서 날거 같음. 서비스센타예약 매우 어려움."
2026 메르세데스-벤츠 AMG SL,9.00,퍼포먼스좋은편이고 희소성은 만족 단 차량감가는 웃으며 무시 옆좌석 불편함은 다시한번 생각해서 만들어주시길 파워는 넘쳐남
2026 메르세데스-벤츠 AMG SL,9.17,고성능차에 특징인 주행 모드별 차의 지향점이 확연한 차이를 보여 컴포트 모드에선 데일리 GT카로 스포츠 모드에서는 고성능 펀카로서 매우 훌륭하고 디자인이나 편의장비 매우 만족감을 느끼게 해줍니다^^ 일상에 즐거움을 줄 수 있는 차!!
2026 메르세데스-벤츠 AMG SL,7.33,"벤츠 최상위트림의 고급감, 포르쉐대비희소성 과 그에따라 갖춘 8기통의 넉넉한 스포츠성, 큰불편함 없는 오너 펀드리븐 주행감(장거리가능), 컴포트주행만 잘한다면 평균연비8찍음 가능, 평소 스포츠주행보다 유유자적한성향이므로 한국미출시중인 43시리즈의 아쉬움(고가의가격포함해서), 이외 리콜수리통지 현재3건으로 상당한번거로움 제하고 전반적으로 펀드라이브가능한 흥미로운차량."
2026 메르세데스-벤츠 AMG SL,8.50,"훌륭한 디자인, 암담한 연비, 좋은 주행성능, 아쉬운 펀치력, 미친 고급감, 나만 타는 희소성 전반적으로는 만족"
2026 메르세데스-벤츠 AMG SL,9.33,벤츠만의 승차감을 느끼면서 스포츠함을 느끼는 특별한차 포르쉐의 감성을 포기한다면 여유로운 차인듯 하다.
2026 메르세데스-벤츠 AMG GT 4도어 쿠페,8.67,"23년식 다이나믹 모델은 GT63과 머플러 빼고 거의 동일한 디자인이라고 보시면 되는데(일반 GT43과 전면, 후면, 선루프 등 디자인 차이가 느껴집니다.), 다른 차는 눈에 들어오지도 않고 망설임없이 예전에 바로 구매했던 기억이 있네요. 아직도 어느곳에서나 존재감이 느껴집니다. 전면은 AMG 고유의 멋드러짐, 측면은 섹시한 라인, 후면은 배트맨 자동차같은 웅장함 등이 총집합되어있습니다. 다만 국내 출시가 43이 아니라 53이었으면 어땠을까 하는 아쉬움은 있네요. 그래도 한국에서 이정도 출력이면 아주 훌륭하고, 운전 재미도 정말 좋습니다. 다이나믹부터 있는 리어액슬, 라이드컨트롤서스펜션, 멀티컨투어시트(조향시 몸 쏠리지않게 잡아주는 시트)가 대박입니다. 제일 큰 아쉬움이라면 브레이크 끼익끼익소리 (AMG의 고질적인 문제점), 전자 기능이 많다보니 생기는 잔고장..이 있네요. 저는 결혼을 앞둔 30대 후반인데, 제 나이대에 이정도면 속도, 디자인, 기능적으로 너무나 만족입니다."
2026 메르세데스-벤츠 AMG GT 4도어 쿠페,10.00,매우 만족하는 차. 타보지 않은 자 함부로 입을 놀리지 마라. 타본 사람만 안다.
2026 메르세데스-벤츠 AMG GT 4도어 쿠페,10.00,5년째 타는중 만족합니다. 패밀리카로 써도 무방합니다. 고속 연비 10-11 시내 연비 7-8
2026 메르세데스-벤츠 AMG GT 4도어 쿠페,9.67,차량이 편안하고 좋아여 ~~~~ 모든 기능에서도 최고로 느끼며 운행하고 있습니다.
2026 메르세데스-벤츠 AMG GT 4도어 쿠페,10.00,펀카로 좋아요. 가끔 밟아주면 재밌어요. 연비 집사람 운전기준 1달에 1번 고급유 넣어요. 매일 출퇴근해요. 제차 GLS580에 비하면 연비 양반이에요. 장거리갈땐 안타요. 승차감이 에어서스들어갔어도 뭐같아서 불편해요.^^
2026 메르세데스-벤츠 AMG GT 4도어 쿠페,7.83,디자인 만족으로 높은 연비 감수하고 계절별로 타이어 교체하며 타는 차 A필러 풍절음 심합니다
2026 메르세데스-벤츠 AMG GT 4도어 쿠페,8.67,벤츠에서 이만한차는 없습니다 잘만듬. 다만 센터 수리나 리콜이 느려서 불편합니다.
2026 메르세데스-벤츠 AMG GT 4도어 쿠페,9.33,"생각 보다 좋은 연비 , 디자인은 최고 , 옵션도 빠지는것 없고 다만 벤츠 서비스 센터 수리를 너무 못해요 입고 후 차량 확인하면.. 동일증상 그대로.. 다른곳 뜯어서 고장만들고,, 서비스센터,, 참,,"
2026 메르세데스-벤츠 AMG GT 4도어 쿠페,9.00,디자인좋고 연비또한 생각보다 좋습니다~ 데일리카로 만족~~~~~~~~~~~~
2026 메르세데스-벤츠 AMG GT 4도어 쿠페,7.83,"생각보다 출력약하지만 재미는 있음, 실용성은 좋은거 같음. 그냥 무난함."
2026 메르세데스-벤츠 AMG GLC,8.67,디자인이나 주행성능은 매우 만족. 초기 시스템의 잦은 에러와 시트의 불편함은 불만족.
2026 메르세데스-벤츠 AMG GLC,9.33,디자인의 끝판완 내외관 따라올 차가 없음.. 쿠페형 SUV의 교과서 같은 차량
2026 메르세데스-벤츠 AMG GLC,5.67,"외내관은 동급 외제suv대비 이쁨, 주행능력은 보통이지만 승차감은 서브차인 국산 세단보다 못함.. 품질은 진짜…최악임 차량받고 400키로탔을 때부터 센터를 들락날락… 만약 시간을 돌릴 수 있다면 xc60이나 x3를 선택했을 것 같음."
2026 메르세데스-벤츠 AMG GLC,9.67,도심에서 짧은 거리를 주행할때는 연비가 기대보다 좋지는 않지만 고속도로 연비는 기대 이상입니다. 실내외 디자인과 거주성은 탁월합니다
2026 메르세데스-벤츠 AMG GLC,9.00,"전반적으로 훌륭하고 크게 단점이 없는 차량입니다. 디자인이나 실내 고급짐은 경쟁차종들이 비할 수 없구요 다만 벤츠 특유의 저단 변속 충격, 약간의 터보렉, 경쟁차종 대비 높은 가격은 살짝 아쉽네요 10점 만점에 9점 드립니다."
2026 메르세데스-벤츠 AMG GLC,9.00,"가성비가 좋지 않은 것과 저속에서의 편안함이 아쉬움 하지만, 벤츠를 가성비로 사는 사람이 있나싶고 SUV인데 저속 편안함까지 바라려면 에어서스 들어간 차량을 타야하지않나 싶음. 즉, 이 정도면 우주명차는 아니어도 훌륭하다."
