car,score,content
2026 혼다 CR-V 하이브리드,8.67,"타보니까 최악의 단점이있는대, 휴대폰과 디스플레이 연결이 자주 끊기는현상이있어 가끔 초기화시켜야함 이게 얼마나 큰 단점이냐면 주행중 내비가 꺼져서 초보자들은 길잘못들고 당황해지는 상황이 자주 발생하게된다는 것임"
2026 혼다 CR-V 하이브리드,9.50,+ SUV에서 느껴지는 세단의 주행감. 롤링이 적고 단단한 하체. 시승하자마자 계획에도 없던 큰 차를 사게된 이유들. 무엇보다 디자인이 어느 차들보다도 마음에 들고 세련됐음. 내외부의 벌집모양 그릴과 아날로그 버튼들이 상남자스럽다고 느껴짐. - 음성인식이 구려서 구글 불러서 쓰고있긴 하나 차 기능통제가 안되는게 아쉬움. (내가 모르는걸지도) 우리나라 선호옵션인 통풍시트의 부재를 고려했을 때 가격경쟁력이 조금만 더 있었다면 우리나라 주력 차로 손색이 없었을 것..
2026 혼다 CR-V 하이브리드,10.00,디자인 연비 주행질감 정말좋아요 직접 타봐아 알수있어요 실연비가 훨씬 높아요
2026 혼다 CR-V 하이브리드,10.00,"싼타페, 라브4, glc 시승 후 주행성능, 승차감 등 모든 점에서 crvr가 마음에 들어 구매함. 다만 고속 주행시 풍절음, 노면소음은 아쉬움."
2026 혼다 CR-V 하이브리드,9.67,Everything is good! 디자인 정숙성 모두 만족합니다. 다음 차량은 어코드
2026 혼다 CR-V 하이브리드,9.33,평균연비18-22 만족 장점은 크지않아도 단점은 없는 그런 차량..고장도없고
2026 혼다 CR-V 하이브리드,9.17,"1. 주행성능 : 아주 만족함, 가솓고 잘 붙음. 다만 약간의 풍절음은 존재함 2. 디자인 : 아주 만족, 특히 흰색이 이쁩니다. 3. 연비 : 연비는 개인별로 다르겠지만 복합 10.8 정도 나오네요"
2026 혼다 CR-V 하이브리드,9.50,오너만이 알수있어서 좋습니다 꼭 시승해보시길 권장합니다. 편리성은 다소 떨어지니 차체만으로 꼭 평가하시길
2026 혼다 CR-V 하이브리드,9.67,아주 많이 안족 하고 주행 연비 모두만족 합니다 기술의 혼다 인것 같습니다
2026 혼다 CR-V 하이브리드,9.33,"장점 : 일본차(인 척 하는 미국차) 단점 : 일본차(인 척하는 미국차) 다른 차들이 인테리어, 편의기능 옵션에 투자할 때 차의 기본기에 투자를 많이 한 차 전기차와 유사한 주행감"
2026 혼다 CR-V 하이브리드,8.83,ㅌㄴㄷㄴㅅㄷㅎㅈㅅㄴㅅㅇㅈㅎㄷㅅㅈㅎㅊㅆㄷㅅㄴㅈㅅㅈㄷㄴㅅㄷㅎㄷㅅㄷㅎㄷㅅㅈㅅㄴㅅㅊ
2026 혼다 CR-V 하이브리드,9.67,차체의 강성 안전성 내구성 연비 승차감 모든게 좋아요 통풍시트가 없는데 이건 튜닝샵에서 튜닝 하려고 합니다
2026 혼다 CR-V 하이브리드,8.67,"일단 주행감이 탁월한건 인정입니다. SUV지만 승용차 같은 승차감이 느껴지고, 토요타 하이브리드에 비해 매우 정숙합니다. 다만 가격 대비 과하게 빈약한 옵션은 구매를 망설이게 할 수 밖에 없는 부분이네요. 이 가격에 정말 이 옵션이 최선인가 하는 생각이 차를 출고한 뒤에도 끊임 없이 들게 합니다. 이전 차량이 말도 안되는 고장으로 사람 뒷 목 잡게 만들던 티구안이었기에, 이런 빈약한 옵션에도 승차감, 연비, 내구성만 보고 구매했습니다. 내구성은 더 지켜봐야 하겠지만 승차감 연비는 박수 쳐줄 만 합니다."
2026 혼다 CR-V 하이브리드,8.33,"전체적인 만족도가 우수합니다. 운전자을 위한 주행 안전성,연비, 내구성이 이차량이 가지는 큰 장점임."
2026 혼다 CR-V 하이브리드,9.83,"현기차 25년 탔는데 엔진오일 소모 등 이런저런 잔고장에 질려서 혼다 crv 하브로 바꿈~한마디로 차량 성능과 완성도는 국산 보다 월등함~정주행시 노멀로 시내 주행 평균 19, 에코로 21 이상 찍고 있음, 고속도로 시속 90~110 주행시 17 이상 나옴. 소음 잡음 없음~일본에게 배울건 배워야 그들을 능가할 수 있다고 생각함~ 정말 만족하고 타고있음~국산차의 화려한 옵션 인테리어는 없지만 불편한거 없음, 차성능에 모두 보상받는 느낌임~"
2026 혼다 CR-V 하이브리드,8.00,출퇴근용으로는 딱!좋으네요. 출퇴근용으로 주유소 한달에 2번이면 유류비용은해결..
2026 혼다 CR-V 하이브리드,9.67,연비좋고 디자인좋고 거주성좋고 가격만 좀 착하게 나왔으면 아쉬움이 있네요 ~ 일본차 특성상 인테리어 편의장비는 고려 하지않았는데 나름 괜찮습니다
2026 혼다 CR-V 하이브리드,10.00,여태까지 수많은 차들을 타봤늣데 왜 혼다차가 기술의 혼다인지 알것같아요 주행 성능 연비 디자인 소음 정숙성 머하나 흠잡을때가 없는듯 벤츠보다도 두단계 앞선다고 생각함
2026 혼다 CR-V 하이브리드,10.00,누군가 그돈씨라고 하면 내돈씨라고 당당히 말할 수 있는 차. 디자인보고 혹해서 시승하고 그 날 바로 계약했음. 주행질감과 승차감은 보급형 suv 중에는 비교 대상 조차 없음 괜히 옵션만 가지고 까는게 아님
2026 혼다 CR-V 하이브리드,7.33,"고민을 하다가 콜레오스에서 CR V 로 시승후 바로 마음을 바꿨습니다. 시승시 만족도가 상당히 좋았고 지금 약 1천 타고 있는 시점에서 전반적으로 잔고장 없이 만족하는 수준입니다. 4인가족 기준 적당한 공간과 주행감 , 연비는 최고 인거 같습니다. 더 타봐야 알겠지만 내부 디자인을 제외하고는 아주 적당한 수준의 SUV 인거 같습니다!"
2026 혼다 CR-V 하이브리드,10.00,"토요타, BMW, 벤츠 등 많은 차종을 운전해 보았지만 현재까지 가격대비 가성비 훌륭하다고 생각합니다."
2026 혼다 CR-V 하이브리드,9.50,전체적으로 무안하고 연비 잘 나오고 디자인 괜찮고 현대 기아차 보단 좋다.
2026 혼다 CR-V 하이브리드,9.67,가격이 스펙에 비해 높은 것을 제외하면 만족합니다. 주행성능과 주행질감은 동급 최고 수준이고 실내 거주성과 시트도 매우 우수한 착좌감을 제공합니다. 몇가지 흔한 옵션이 빠진게 이해가 안되지만 감안하고 탈만합니다.
2026 혼다 CR-V 하이브리드,9.17,역쉬 차는 차로써의 주행성능이 우선시 되어야 하는 것 같습니다. 아주만족스럽습니다.
2026 혼다 CR-V 하이브리드,9.67,"현재까지 6개월 운행하였고 그동안 느낀 장단점입니다. - 단점: 1. 미국 타겟으로 생산된 차다보니 옵션 부족(통풍, 2열열선시트, 작은 사이드미러, 어라운드뷰 등). 2. 조립 마감, 단차 있음. - 장점: 1. 미친 주행감. 동급 여러 브랜드 차량 시승해봤는데 주행질감과 승차감은 cr-v가 압도적이었음. 2. 엑셀, 브레이크 반응성 매우 우수. 기본기가 좋다는게 이런거라고 처음 알게됨. 3. 2열 공간이 넓고 뒷문이 90도로 열려 자녀가 있는 가정이라면 아주 편리함. 4. 연비는 겨울철에 조금 떨어지나 평균 20km 나옴.(출퇴근 기준 고속+국도 편도 20km 주행함). 특히 전기>내연 주행 시 이질감이 매우 작고 시속 90~100km에서도 조건이 맞으면 전기모드로 주행함. 5. 정숙성도 고급 브랜드만큼은 아니지만 동급 차량 대비 가장 좋았음."
2026 혼다 CR-V 하이브리드,8.67,북미생산 차량의 전체적인 품질이 차가격대비 떨어진다는게 정설입니다. crv도 조립품질이 좋은 편이 아닙니다. 북미에 맞춰져있는 차라서 국내 대비 옵션도 많이 부족하지만 동급대비 주행성이 비교불가한 수준입니다.
2026 혼다 CR-V 하이브리드,8.17,"우수. 디자인, 주행성능 . 미흡. 기격, 옵션, 수리비용........"
2026 혼다 CR-V 하이브리드,9.83,"단점: 운전석 사이드미러 교환 필요, 뒷좌석 열선 없음, 약간 아쉬운 풍절음. 장점: 무난하고 질리지 않는 디자인, 딱 필요한 정도의 실내와 직관적이고 깔끔한 기계식 버튼과 공조 장치 등, 안정적인 연비와 주행 성능, 혼다 센싱의 빈틈없는 안전 보조 기능, 20년넘게 검증된 일본의 하이브리드에서 더 개선된 2세대 엔진. 사실 그랑 콜레오스랑 많이 비교되지만, 엔진에서 중국산이냐 기술의 혼다냐 하나로 혼다로 택했고, 차는 심장이 중요하다고 생각하니 후회없는 선택이었다고 생각함. 초기 모델은 검증이 필요한데 르노 하이브리드나 센싱은 검증이 더 필요해보임."
2026 혼다 CR-V 하이브리드,9.50,"주행성능, 내구성 모두 좋습니다. 가격이 다소 비싼부분은 다른것으로 커버가되고 실용적이지 않는 옵션에만 포인트를 두고 차를 고르지 않는다면 아주 탁월한 차량이다고 말할수 있습니다"
2026 혼다 CR-V 하이브리드,10.00,"처음에 가격에 의구심을 가졌지만, 시승 후 생각이 달라졌습니다. 부족한 내부 옵션질보다 기본 내구성과 모터에 바탕을 둔 혼다 승차감은 딱맞는 가격이라고 생각합니다.정말 만족합니다."
2026 혼다 CR-V 하이브리드,9.83,"SUV고민 중이라면 시승이라도 해보세요. 훌륭한 연비, 뛰어난 주행감, 충분한 공간, 정석적인 디자인.. 뭐가 더 필요합니까? 괜히 깐깐한 북미 판매량 탑이 아닙니다."
2026 혼다 CR-V 하이브리드,9.00,"초기 구매가격과 옵션 보면 이돈이먄,,,생각 들지만 집에 두대 끌고 있는데 가족 모두 매우 만족 중입니다"
2026 혼다 CR-V 하이브리드,9.67,"많은 고민끝에 구입을 결정했는데…아직까지는 아주 만족합니다. 생각했던 것보다 실내거주성이 너무 좋고, 힘은 딱 필요한 만큼 내주네요. 편의사양도 나름 좋아요. 다만, 딜러가 아닌 큐레이터 방식으로 바뀐 것은 매출에는 도움이 될지 몰라도 고객은 만족스럽지 않네요. 나중에 다시 차를 사게 되면 이부분이 혼다차를 고르는데 큰 마이너스로 작용할 것 같습니다."
2026 혼다 CR-V 하이브리드,9.67,운전하는 재미는 없지만 이가격에 필요한건 다 가지고있으면서 승차감이 매우 좋음. 괜히 옵션빨인 국내차 사는바에 돈 쪼금 더주고 이차사는게 훨씬나음.
2026 혼다 CR-V 하이브리드,9.83,"차량 구입 후 2개월 타보고 적습니다. 구매 전 단점은 가격이 조금 비싸다 는 점이었는데 실구매 후 주행해 본 결과 구매 가격이 비싸서 아쉽다는 생각은 사라졌습니다. 먼저 주행감이 정말 좋습니다. 하이브리드에서 느껴지는 이질감이나 특유의 좀 거슬리는? 그런 부분이느껴지지 않아요.( 캠* 하이브리드도 타고 있기에 비교 가능.) 밟을 때 잘 나가고 브레이크 부드럽게 잘 먹히고 가족 및 지인들 탔을 때 차 승차감 좋다고 이야기 합니다. 연비 뭐 이거는 칭찬하는 게 무색 할 정도. 장거리 한 번 뛰고 오면 기본 0.5 이상 올라가네요. 출퇴근 거리 짧은 시내 주행 주로 하고 있는데 17.2 나오고 있습니다. 17 밑으로 내려간 적이 없어요. 전기 개입 비율이 높아서 그런지 캠* 보다 시내 주행 포함 연비가 높습니다. 차량 공간, 실내 공간 넓고 트렁크 아이 짐 가득 들어갑니다. 자전거 킥보드 유모차 다 싣고 놀러가네요. 옵션은 기존 차량(Qm3) 10년타고 교체한거라 저는 만족합니다"
2026 혼다 CR-V 하이브리드,9.83,"현란한 내부 인테리어는 없지만, 차의 성능과 기본기에 충실한 차 입니다. 시승 전에는 후보군 중 하나였는데, 시승하면서 바로 선택하게 되었습니다. 확실히 주행 성능과 느낌이 다릅니다. 전반적으로 패밀리카로 사용하는데 내부 공간 활용도 등 전반적으로 만족합니다. 단, 국내 에서 보편화된(통풍 시트 등) 일부 기능들이 없지만 필요하면 사재로 장착 가능하여 특별히 고민 하지는 않았습니다. 근데, 막상 트렁크 센서와 보조석 카메라 등은 추가로 달려 있어 아직은 특별히 불편한 것은 모르겠습니다."
2026 혼다 CR-V 하이브리드,9.67,"탈수록 마음에 듭니다. 2세대 3세대 차량도 고쳐가며 아껴타는 분들이 많습니다. 타시는 분들이 왜그렇게 칭찬하는지 조금 알것 같아요, 디자인도 볼수록 멋지구요, 주행질감 묵직하고 좋구요, 조용하고, 스피커 음질, 시트 편안함, 2열 넓고, 트렁크도 넉넉합니다. 국내차량 필요한 옵션 넣다보면 5천 육박하죠. 여러가지 고려해서 cr-v를 선택할 수 밖에 없었구요. 마침 프로모션이 좋아서 할인, 평생엔진오일 무료 제공받았구요, 할인가로 욥션 몇가지 추가하였습니다. 특히 2열 레그룸, 천정 높이 괜찮고, 리클라이닝 기능 가족들도 마음에 든다합니다. 혼다센싱 등 안전기능 있지만 더 조심하고 안전운전하겠습니다~ 꼭 시승해보시길 바래요!!"
2026 혼다 CR-V 하이브리드,9.67,"구매 마지막까지 일본 브랜드라 고민했는데 주말 여행 동안 잘한 선택이였다는 생각이 듭니다. 연비 대만족, 거주성 만족, 품질 만족, 디자인 만족, 가격 살짝 아쉬움....... '내 차가 되기 전까지 욕하지만 내 차가 되고 나서는 만족'이란 말이 딱인거 같네요. 다음 차도 특별한 일 없으면 C-RV가 되지 않을까? 합니다."
2026 혼다 CR-V 하이브리드,9.67,혼다차만타는데 이번에는 단차가 꽤 많이잡혀서나오는거에놀랍고 주행성능이야 혼다니까 당연한거고 동급SUV중에서 이만한차가 있을까싶은차. 혼다센싱도 개선많이되었고 넓은실내에 RAV4와 비교해서 실내인테리어는더나은차량 국산차와 실내편의성 인테리어비교를많이하는데 혼다는주행성능보고사는차라 비교불가 이만한SUV가없음.
2026 혼다 CR-V 하이브리드,9.33,Suv의 교과서 승차감 이급 suv중 최고라고 생각하며 6세대 들어와 디자인도 새련되고 연비도 좋고 가격이 조금만 저렴하면 좋겠지만 옵션은 사재로 조금 채워야 하는 등의 단점보다 타는 순간 단점 생각이 안남
2026 혼다 CR-V 하이브리드,10.00,차출고후 타보니 정숙성 승차감 전부만족합니다 고급스러운느낌도 있고 탈수록 혼다센싱등 편의사항이 훌륭합니다 시승하고 구매했는데 여러차 동시시승하면 구매하게됩니다 쏘렌토하브대기중 시승후 구매하게되었습니다
2026 혼다 CR-V 하이브리드,9.67,"일단 비싸다고 하시는 분들은 타보고 얘기하라고 하고 싶네요. 국산차보다 옵션은 떨어지지만 안전성, 정숙성, 승차감 등 종합적으로 쏘렌토 싼타페보다 월등합니다. 보기보다 차가 커요. 실내 공간 및 트렁크 공간 넓습니다. 골프백 캐디백 4개 여유있습니다. 부족한 옵션은 사제로 시공해서 타고 있습니다. 완전 대만족입니다."
2026 혼다 CR-V 하이브리드,9.67,하이브리드 2륜 3월 부터 타고 있습니다. 안드로이드오토는 설정에서 무선으로 풀 수 있으며 무선연결잘 됩니다 출퇴근 용으로 타고 있으며 연비 너무 좋고 장거리 주행느낌도 좋습니다. 인테리어 볼매입니다. 후회안하실 것 같습니다.
2026 혼다 CR-V 하이브리드,9.83,"약간 비싼듯한 가격, 몇몇 옵션 없고, 광각아닌 왼쪽 사이드미러, 유선 안드로이드에도 불구하고. 6개월 운행경험으로 기본기 탁월, 고속도로 18~19 시내 약 13 으로 평균 연비 14.2, 승차감 우수, 소음 별로 없음, 넓은 1 &amp; 2열 공간, 충분한 적재공간 등등. 주변에 강력 추천"
2026 혼다 CR-V 하이브리드,10.00,"어떻분 리뷰 승차감이 둥실둥실 그런 표현을 쓰셨는데 승차감 주행질감 최고 입니다. 고속에서도 안정감이 있고 타보신분들 표현이 뒷자석과 앞자석 승차감이 동일하고 승차감 좋다 하십니다, 아무튼 고장없이 오래 타고 싶습니다."
2026 혼다 CR-V 하이브리드,9.67,"6세대 하브 2륜..주행시 부드러운 느낌이나 안정성이 정말 좋네요..실내도 만족 스럽고..연비도 좋구요..출퇴근, 여행, 패밀리키로 최적..운행할 마다 만족하며 타네요.."
2026 혼다 CR-V 하이브리드,9.67,"주행 승차감 내구성 등 차의 기본기 우수함만 보고 선택하여 만족합니다. 경쟁차종 대비 비싼가격, 좌우 밀러 미통풍시트 2열 미열선 등의 불편함은 금방 익숙해집니다."
2026 혼다 CR-V 하이브리드,6.33,"30년 후퇴한 전장과 해상도 조악한 것 빼고는, 자동차의 기본 주행이나 안정성 및 승차감은 좋음"
2026 혼다 CR-V 하이브리드,9.50,2륜 하브 받은지 3일 됐습니다. 내부 옵션 보고 구매한거 아니고 차 자체만 보고 샀습니다. 주행성능 너무 좋습니다. 승차감 좋고요.. 가격은 경쟁사 대비 비싸지만 충분히 만족합니다.
2026 혼다 CR-V 하이브리드,9.17,"국산차 생각하면 그돈씨 소리 나올 수 있는데, 미국 살 때 탔던 3세대 기억이 좋아서 아기들 태어나고 패밀리카로 다시 이 차를 구매했습니다. 쏘카로 투싼이나 스포티지 타고 혼자 전시장 가서 시승해보면 바로 느낄 수 있을탠데 이 급 suv가 이런 주행감이라고? 하실거에요. 독일차의 단단함이랑은 좀 다른데 굽은 길에서 언더스티어가 심하지 않고 예민하진 않지만 조작하는대로 잘 따라와줍니다. 저배기량 터보에 cvt로 바뀐게 좀 적응이 필요하긴 합니다"
2026 혼다 CR-V 하이브리드,9.50,"일단 실내공간이 놀랄 정도로 넓고, 주행성 기대이상으로 좋습니다. E클 탈 때보다 마음에 안드는 점이 하나도 없는 신묘함.."
2026 혼다 CR-V 하이브리드,9.00,"6세대 하브 4륜 타고 있는데 1열 통풍 2열 통풍,열선 없는거 빼고는 매우 만족하고 있습니다 코너에서 일정속도에도 밀리지 않는 안정감 핸들의 적당한 묵직함이 주는 탄탄함 하브라서 고속20(현재 제가 찍어 본 최대),시내 16~17정도의 연비 나옵니다 기본기 정말 좋구요 여름되면 통풍 없는게 너무 아쉬울것 같기는 하지만 나머지 안정감 때문에 만족하고 있습니다 혹시 그놈의 안정감이 뭘까 싶으신분들은 시간되시면 시승한번 해보세요"
2026 혼다 CR-V 하이브리드,9.17,모든부분에서 만족스럽고 감히 명차라고 말할 수 있습니다. 주변의말에 속지마세요 가격이 비싸지만 그 값이상 합니다
2026 혼다 CR-V 하이브리드,9.17,가성비가 너무 좋은거 갔습니다. 단지 핸들과 뒷좌석 열선이 없어서 아싑습니다.
2026 혼다 CR-V 하이브리드,9.67,"연비가 평균 약16,Km로 상당히 만족하며 주행가이나 정숙성 .안전성등 운행을 하면 할수록 더욱 차에 대한 신뢰가이 항상되며 지인들에게도 적극적으로 홍보하고있음. 차후 다시 구매해도 혼다 차량을 이용하고 싶을 정도로 차에 관한 선택이 충분했음에 만족함"
2026 혼다 CR-V 하이브리드,10.00,처음 느낌보다 탈수록 그 진가를 발휘하는 차~~ 부드럽게 잘 달리고 부드럽게 잘 서고 안전하고 오랜 기간 고장없는 차~ 혼다센싱을 포함한 잘~~~~ 세팅된 느낌
2026 혼다 CR-V 하이브리드,8.67,"인테리어는 10년전 인테리업니다. 연비는 10.4나옵니다. 안드로이드 오토 무선지원 안합니다. 사이드 미러 자동으로 안접힙니다. 통풍시트 없습니다. 하지만 외관은 이쁘고 차가 넓고 잘 나갑니다. 많은 단점이 있지만 사실 가장 중요한 거는 차가 자기 역할을 잘 수행하냐이고, 이 점에서 저는 만족합니다."
2026 혼다 CR-V 하이브리드,9.67,기본에 충실한 ~그렇다고 디자인 승차감 연비 등 뒤처짐이 없는 차~처음보다 지난 지금이 더 맘에 드는 차~타보시면 압나다!!!
2026 혼다 CR-V 하이브리드,9.17,라브4와 CRV 시승 후 승차감 보고 택했습니다. 가솔린모델이지만 연비 잘 나옵니다 고속도로 출퇴근하는데 잘 나올 때는 19키로까지 나옵니다 ㄷㄷ 다만 가솔린모델이고 옵션이 조금 부족한데 4천만원대라 가성비는 좀 떨어지는 듯 합니다
2026 혼다 CR-V 하이브리드,10.00,혼다 엔진은 정말 좋은 거 같습니다. 도심형 비는 14킬로 고속도로는 21키로 나옵니다
2026 혼다 CR-V 하이브리드,10.00,주행성능 및 모든 항목 다 만족스럽다. 연비는 공인연비와 동일하며 고속도로 연비는 18~19 정도가 나온다. 디자인도 무난하며 실내공간도 넓다. 몇가지 옵션이 빠져있지만 크게 아쉽지는 않다.
2026 토요타 프리우스 플러그인 하이브리드,9.00,연비 우주 최강인 차량임 디자인도 훌륭하고 주행성능 탁월하지만 실내소음 큼
2026 토요타 프리우스 플러그인 하이브리드,9.67,세련된 디자인에 우수한 연비를 보장함. 다만 뒷좌석은 키큰 성인 남성이 장시간 타기엔 무리가 있다.
2026 토요타 프리우스 플러그인 하이브리드,8.17,"실내공간 거주성이 체형에 따라 다르겠지만 적응하면 크게 불편하진않음. 다만 무릅양옆이 모서리에 닿아 아픈게 신경쓰이고 야구모자쓰고 타면 천장에 계속 걸림.전동 트렁크 빠진것과 어라운드뷰 없는것 아쉬움.팔걸이가 인체공학적이지 않고 불편하며 변속기 주변 피아노 블랙 관리 불편함. 주행과 연비,안전보조등은 만족함. 엔진솔 유입 좀 거슬림"
2026 토요타 프리우스 플러그인 하이브리드,10.00,2013년 프리우스를 5년 동안 타고 만족도가 높아 10년만에 다시 구매했는데 만족도 극상입니다. 1. 미래지향적인 디자인 2. 안전 및 편의 사양 3. 출력 및 연비 4. 충돌테스트 세이프티 픽 플러스라 또 안심 앞으로 쭉 안전하게 탈 예정입니다.
2026 토요타 프리우스 플러그인 하이브리드,10.00,주행 부족하지 않고 가격 괜찮고 182기준 1열 여유 2열은 좁으나 내가 탈일이 앞으로 손에 꼽을 것이기 때문에 문제 없고 품질 디자인 좋고 연비는 최고
2026 토요타 프리우스 플러그인 하이브리드,9.83,국산차보단 내부옵션이 부족하긴 하지만 성능면에선.. 말이 필요없네요 만족중입니다
2026 토요타 프리우스 플러그인 하이브리드,9.67,"연비, 디자인, 주행감 모두 너무 마음에 듬 세컨차로 구입했으나 메인으로 타는 벤츠GLC보다 더 자주 타게 됨"
2026 토요타 프리우스 플러그인 하이브리드,9.00,국산차 하이브리드 가격이랑 차이가없고 국산차 하이브리즈살빠에 검증된 토요타하이브리드가 낫다고 판단 연비가 28키로씩 찍히는기적을 보여줌 디자인도 좋아
2026 토요타 프리우스 플러그인 하이브리드,9.83,"연비왕 프리우스답게 25~27 기본 겨울 최저 18~20연비 나옵니다, 5세대 상당히 앞유리가 낮습니다, 차주분 키177이하 추천합니다. 5세대 희소성도 낮아좋고 암튼 프리우스 차주라 행복합니다"
2026 토요타 프리우스 플러그인 하이브리드,9.50,예상했던 승차감보다 훨씬 좋았고 가격을 빼곤 다 만족합니다. 할인이 없는게 좀 아쉽네요 ㅠㅠ
2026 토요타 프리우스 플러그인 하이브리드,8.83,"디자인은 넘사벽, 하이브리드 완성도도 넘사벽.. 다만 이가격에 V2L 뺀거는 좀 선씨게넘음 PHEV 사고 V2L 없아서 혈압올랐음. 그냥 대충 샀는데 설마없을 줄는 ㅜㅜ.. Ride ,Handling 발군. 승차감의 Flat 감이 매우 인상적이며 핸들링 또한 인상적임. 스티어링 튜닝을 아주 잘한 것 같음.. 부품가격 사악.."
2026 토요타 프리우스 플러그인 하이브리드,10.00,매우 좋음 연비는 4세대보다 조금 떨어졌지만. 기능 업그레이드가 잘 됨
2026 토요타 프리우스 플러그인 하이브리드,8.00,소음과 가격이 아쉽지만 준수한 주행성능과 하이브리드의 최고점을 느낄 수 있음
2026 토요타 프리우스 플러그인 하이브리드,9.50,"승차감, 코너링, 연비 모두 완벽 거기에 디자인까지 가격이 조금 높아서 단점이지만 가격 빼고 모든면에서 만족 실내공간도 생각보다 좁지 않습니다"
2026 토요타 프리우스 플러그인 하이브리드,8.67,예쁘다 연비가 좋다 여성이 타기에 크기가 아담해서 좋다 키큰사람이 타기는 힘들거같음 뒷자리는 에어컨이나 히터가 안닿아서 춥거나 덥다
2026 토요타 프리우스 플러그인 하이브리드,8.83,연비를 생각하는 분이라면 1순위로 이 차를 고를 만큼 자부심 있는 차. 모든 면에서 만족하지만 엔진소음과 풍절음은 조금 아쉬운 부분.
2026 토요타 프리우스 플러그인 하이브리드,8.00,무난하게 잘 나가고 잘 서고 디자인도 괜찮거 일상주행에 좋은 차 입니다.
