car,score,content
2026 메르세데스-벤츠 GLA,9.00,"인생 내 명의 첫 차이자 마지막 내연기관 엔진 차라고 생각하고 구매했습니다. 벤츠 입문으로는 적절한 가격대라고 생각합니다. 다 좋은데 역시 패밀리 카로는 부족하고 남자 넷이 타기엔 좁습니다. 연비는 기대 안하시는 게 좋습니다. 고속도로 잘 타면 15, 도심은 10 내외입니다."
2026 메르세데스-벤츠 GLA,9.67,소형차이면서 고급인 국산차가 없기에 하는 수 없는 선택이었습니다. 미니도 보유하고 있는데 이 두차 모두 수명 다할때까지 탈 생각입니다. 두차 모두 운전석에 앉으면 웃음이나고 즐겁습니다. 연비요? 며칠 전 영종도 다녀왔는데 18l/km 넘게 나오더군요. 기대 이상이라 좀 놀랬습니다. 또 좋은점은 겉보기에 머세이디즈처럼 보이지 않습니다.
2026 메르세데스-벤츠 GLA,9.33,"디자인,주행성능,안전성 모두 좋으나 연비가 조금 아쉽네요. 전체적인 평가는 아주 만족합니다"
2026 메르세데스-벤츠 GLA,8.67,디자인도 무난하며 잔고장 없고 주행 안정성은 좋으나 뒷좌석이 좁은것이 험입니다 내구성도 좋고 보편적으로 만족합니다
2026 메르세데스-벤츠 GLA,7.17,대쉬보드가 좀 높아서 앉은키가 작은 여자가 운전하기엔 시야확보가 좀 어렵다는 점. SUV라 코너링이 좀 부드럽지 않다는 점 빼고는 아주 좋습니다.
2026 메르세데스-벤츠 GLA,8.67,연비생각하고 타면 안되는 뻰쥬. 성능은 기가막힘. 토크빨 조심해야해요.
2026 메르세데스-벤츠 GLA,9.67,만족합니다 추천합니다 가성비 좋고 주행속도 좋고 불편함 없음 ㅎㅎㅎㅎㅎㅎㅎㅎㅎㅎㅎㅎㅎㅎㅎㅎㅎㅎㅎㅎㅎㅎ
2026 메르세데스-벤츠 GLA,7.83,소형 SUV차량대비 가격은 좀 비싼편이나 디자인면에서는 넘사벽 입니다..
2026 메르세데스-벤츠 GLA,7.67,괜찮아요 편의는 국내 브랜드 못따라가죠. 여성이 타기 너무 적합한 차량 사이즈인것같아요
2026 메르세데스-벤츠 EQB,9.50,"가족용 차로는 최강 100년의 역사가 느껴지는 전기차 같지 않은 승차감, 성능, 합리성, 안전성, 거주성이 좋습니다. 냉각수 이슈가 있으나 모터, sk밧데리 관리능력이 좋고 특별히 동력개통 문제가 없음"
2026 메르세데스-벤츠 EQB,10.00,패밀리 벤츠 전기차 대만족! 여름엔 450 겨울엔 350 주행가능 합니다.
2026 메르세데스-벤츠 EQB,9.83,벤츠의 브랜드에 어울리는 전기차 입니다. 차량 성능은 물론 옵션/디자인 모두 좋습니다.
2026 메르세데스-벤츠 EQB,10.00,"타본사람만 공감할겁니다. 디자인, 주행 다 만점입니다. 다만 주행거리가 부족합니다."
2026 메르세데스-벤츠 EQB,8.83,"24년 3월 구입. 실내공간은 엔트리레벨 대비 넓어서 대딩, 고딩 2명 포함 성인 4명이 타도 괜찮고 시야가 넓어서 좋음 내연기관차량인 GLB 를 전동화 하거라 전기차 특유성은 없으나 내연기관 차량을 운전하는 질감이랑 비슷하면서 치고 나가는 힘 좋음. 불 나도 물리적으로 문 열 수 있어서 안심 배터리는 여름에는 450킬로 정도 되고, 겨울에는 300정도 되는 듯. 전비는 4.6 정도 나와서 소소 (아내가 회생제동 많이 들어가는 것 싫어해서 D로 셋팅해서 그런 듯) 외관은 나는 별로 인데 아내가 좋아해서 구매했기에 만족 불만족 사항은 핸들열선이랑 통풍시트 없는 것과 뒷좌석 열선 없는 것은 큰 불만(우리는 애들은 거의 안타서 크게 불편함 없으나 애들 있는 집은 참고 필요) 충전의 경우 집밥 있으면 베스트오브베스트이고 아직 전기차 많이 없어서 항상 주차공간이 있는 건 큰 장점. 요즘 벤츠 전기차 화재로 걱정이 있는데 테슬라도 불나고 심지어 사람도 죽는데.. 선택의 문제인 듯"
2026 메르세데스-벤츠 EQB,9.33,"정통 SUV 형태의 박스카 디자인과 IONIQ5, ID4, TESLA Model Y 주행 느낌과는 좀 다른 뭔가 묵직하면서도 아주 매끄럽게 나가는 주행질감과 웬만한 잔진동 다 흡수해 주는 승차감이 아주 좋을뿐만 아니라 4MATIC (Dual Motor) 의 가속감도 (특히 Sport Mode) 아주 좋고요~ ^^ P.S. D auto (자동 회생제동) 의 gliding (coasting) 기능 등을 적절히 잘 이용하면 4륜 2.4t 차량 무게 같지 않게 전비도 잘 나옵니다. ;-) P.P.S. 차선 유지 및 차간 거리 유지 자동 제동 그리고 속도 제한 표지판 인식 제한 속도 유지 등 반 자율주행도 잘하네요~"
2026 메르세데스-벤츠 EQB,10.00,제네시스 suv 타다 넘어왔는데 확실히 gv 시리즈랑은 다르게 코너 돌 때 + 주행할 때 하체의 탄탄함은 미쳤습니다.. 이래서 벤츠 벤츠 하나봅니다..
2026 메르세데스-벤츠 EQB,10.00,"기대보다 더 만족스러운 차, 벤츠 전기차는 직접 타본 사람만 평가 가능하죠"
2026 메르세데스-벤츠 EQB,6.67,"EQC보다도 실내공간에서는 우위를 점하고, 주행능력에서는 상당히 괜찮음 다소 주행거리가 짧게 느껴질수 있으나 , 공인 거리와 다르게 실제로는 생각보다 주행거리가 높게 나옴 봄/여름철 풀충전시 580km정도, 겨울에는 400km도 어렵긴함 문제는 벤츠서비스센터의 전문성부족과 대처가 브랜드가치를 따라가지를 못함"
2026 메르세데스-벤츠 EQB,9.67,"고속도로 주행시 약 350키로 주행거리. 시내 주행시 약 450키로 주행거리. 시내 운행 및 출퇴근시 문제없으나, 장거리 운행에는 적합하지 않은듯.... 제외하고 만족. 뽑기운이 있겠지만 많은 분들이 얘기하던문제들은 없어 잘 타고 다니고 있어요~~"
2026 메르세데스-벤츠 EQA,10.00,앞으로도 고장만 안난다면 폐차할때까지 타고 싶을 정도로 만족합니다
2026 메르세데스-벤츠 EQA,10.00,큰차가 필요없어서 사이즈가 작은 차로 구매했는데 전반적으로 만족스럽습니다.
2026 메르세데스-벤츠 EQA,10.00,완전좋습니다 가격도저렴한편 무엇보다 전기차같지않은 승차감 무슨말인지는 타보시면아실겁니다 무조건강추 200%만족합니다
2026 메르세데스-벤츠 EQA,9.67,아는사람만 아는 벤츠 효자차 같네요 비엠과같은 재미는 떨어져도 장거리 출퇴근엔 최고입니다.
2026 메르세데스-벤츠 EQA,9.00,22년 12월에 사서 현재 86000km 주행했는데 여름에는 주행거리 420은 거뜬히 나오고 겨울에는 380정도예요. 혼자 타고 다니기에 아주 좋고 아직 아이가 없어서 부부 둘이 타고 다니기엔 당연 무리 없고요. 큰 캐리어를 실을려면 뒷자리 펼쳐야 하는데 적재하기에 나쁘지 않아요. 연비면에서는 진짜 최고입니다. 배터리만 괜찮으면 계속 타고 싶은 차예요.
2026 메르세데스-벤츠 EQA,8.17,페이스리프트 된 차량을 샀고 현재 3개월 넘게 탔어요 벤츠에 꽃혀 산거라 개인만족도는 높습니다 단지 최근 배터리 이슈 때문에 불안함은 내심 있습니다만 전기차가 갖고 있는 단점이겠죠~~(구매할때 한국산 배터리라고 딜러분이 이야기 하셨어요) 패밀리커로는 조금 작은듯 싶어요 트렁크 용량은 마니 아쉽습니다~~ ㅠㅠ 유모차 하나 넣으면 가득찹니다...ㅠㅠ
2026 메르세데스-벤츠 EQA,9.50,예뻐요~ 감성자극하는 엠비언트는 매력만점입니다. 승차감도 세단 못지않게 좋은 편입니다. 주행거리도 공인연비를 뛰어넘습니다. 아쉬운건 가격이 좀 비싸서 같은 가격에 다른 선택지가 많은게 흠입니다. 트렁크도 좀 작아서 골프백 넣으려면 의자접어야해서 아쉽습니다. 마지막으로 벤츠 네비게이션은 안습입니다.
2026 메르세데스-벤츠 EQA,9.17,구입한지 1년도 채 안돼 배터리가 갑자기 뚝뚝떨어지며 꺼져버려서 견인해 보내고 50일 기다려서 새배터리로 교체했어요 독일서 오느라 시간이 걸린다고 두세달얘기하더니 빨리 온거라네요 그땐 산걸 살짝 후회했었는데 그뒤로는 너무 좋아요 100% 충전하면 450이상 나오는데 그렇게 타본적은 없어요 50~100남으면 충전하는지라 400 조금 넘게 타본게 최고네요 암튼 충전비가 기름넣을때의 4분의1정도밖에 안들고 톨비도 반값에 매달 2만원이상 전기차카드할인받고하니 살때 빼고 돈이 별로 안들어요 전기차사길 정말 잘한것 같아요 근데 차가 가벼운 느낌이라 핸들 살짝 틀어도 흔들브레이크 밟으면 울컥 옆사람이 멀미난대요 소형 전기차가 다 그런걸가요 eqa의 문제일까요 eqe 탈때는 좀 덜했거든요 소형suv를 원했던지라 90%이상 만족하고 있습니다
2026 메르세데스-벤츠 EQA,9.17,장거리 출퇴근자인데 전비를 포함한 모든 것이 만족스럽습니다. 배터리 안전성만 좀더 검증이 된다면 더할나위 없을 듯
2026 메르세데스-벤츠 EQA,9.00,전반적으로 2년 가까이 이용을 하였는데 큰 불편함 없이 만족하며 이용중.
2026 메르세데스-벤츠 A클래스 세단,8.50,2023.7월부터 지금까지 첫 차량으로 잘 이용하고 있어요 시원하게 잘 나가요
2026 메르세데스-벤츠 A클래스 세단,7.67,생각보다 고속주행 연비 괜찮습니다 시속 200까지 밟아본적 있고 입문자용 amg로 너무 만족스러운 주행 잘나가고 밟는 재미가 있습니다. 하지만 생각보다 차체가 낮아 주차장 진입과 방지턱에서의 당황스러움은 아직 불편합니다. 항상 도착지의 주차장을 생각해야하고 경사진 후면주차와 각도가 빡신 주차장의 진입 시도는 접으셔야합니다
2026 메르세데스-벤츠 A클래스 세단,8.17,앰비언트라이트 항공모터송풍구 일체형계기판 등 낮에는 물론 밤에도 디자인에 감성까지 훌륭하고 여자 혼자 강아지랑 드라이브 다니기엔 이보다 더 좋을 수 없습니다. 고속주행 시 정말 안정적이고 150대까지 밟았는데도 차체가 가벼워 밟는대로 잘 나가고 특히 스피드 모드에서는 운전이 재밌습니다. 차가 작아 주차하기에도 편하고 서울도심 주행 시 최곱니다. 하지만 아직 2만5천도 안됐는데 2만넘어가니 슬슬 dct 꿀렁거림이 느껴지고 엔진 스티어링 휠 덜덜거림이 느껴집니다.. g80풀옵이 메인인데 이거랑은 비교가 안됩니다. 고급세단이긴 하지만 내장시트 감촉부터 운행시 승차감이 현저히 제네시스가 월등합니다 ㅜ 하지만 내부 디자인은 벤츠a클이 승..예쁜게 다해요.
2026 메르세데스-벤츠 A클래스 세단,9.00,"엔진은 최고,디자인도 최고...그치만 옵션은 gg. 국산차 풀옵타다가 바꾼지 4년됐는데 핸따 안되고 냉풍시트 안되고...스위치들 불편하고...아무튼 그렇다ㅋ"
2026 메르세데스-벤츠 A클래스 세단,9.50,A35에서 A45S 기변입니다 솔직히 벤츠A클이 내려쳐진 현재 평가에 비해 가성비든 뭐든 정말 엄청나다는거를 오너분들이라면 다 알고계실겁니다 운전아마추어를 위한 4matic+덕에동급타브랜드보다 훨씬 안정적이게 주행퍼포먼스를 뽑아낼수도 있고요 근데 이거살거면 M2가 감가가 압도적으로 방어잘되는거 생각하면 M2가 사실상 더싼데 왜사냐고요? 몰라요 그냥 벤츠가 겁나이뻐요 나도아니까그만물어봐
2026 메르세데스-벤츠 A클래스 세단,9.67,차가 엄청 잘 나가요. 고속에서 주행안정성도 좋고 전반적으로 엄청 조용하고요. 타면 탈 수록 엄청 더 만족하면서 타고 있어요. 완전 최고!
2026 메르세데스-벤츠 A클래스 세단,2.33,수시로 엔진경고등이 떠서 여러차례 수리했고 또 언제뜰지몰라 불안해서 타고다니기 불안해요
2026 메르세데스-벤츠 A클래스 세단,10.00,"AMG A35 Facelift 모델 리뷰 ■ 장점 1. 디자인: 페리되면서 AMG 파나메리카나 그릴과 AMG 아팔터바흐 배지 적용되었고, 범퍼 디자인도 바뀌어서 차가 작지만 스포티한 고성능 차량임을 잘 보여줌. 실내도 AMG 스티어링 휠과 알칸타라 시트&빨간 안전벨트가 예쁨. (와이프가 이뻐서 좋아함) 2. 주행성능: 306마력 40.8토크로시원하게 치고나가는 운전하는 재미. 4matic 적용으로 고속주행 및 코너링에서 바닥을 쥐고 가는 안정적인 느낌. 3. 범용성: 컴포트 모드에서 승차감도 좋고 일상에 무난하게 타기 좋음. 48볼트 마하 적용되서 고속주행시 연비 15 km/L이상 나옴. ■ 단점 1. 저단 꿀렁거림 현상: 가다서다 막히는 길 1-2단 변속 시 꿀렁거림 현상 있음. 2. 낮은 지상고: 페리모델은 좋아졌지만, 일반 세단에 비해 낮은편이라 방지턱, 급경사 만나면 30km이하 주행 필요. 아파트 주차 스토퍼에 딱 붙이면 리어 스포일러랑 1cm 남음(파손 위험)"
2026 메르세데스-벤츠 A클래스 세단,9.83,벤츠니까 일단 디자인 이미지 승차감 나쁘지 않습니다. 그래도 비엠이랑 제네시스랑 비교해보고 고르세요!
2026 메르세데스-벤츠 A클래스 세단,9.00,동네 마실용으로 경차보다 오히려 좋은거 같아요 좋아요 조하아어ㅓ아아아ㅏ아아ㅏㅇ
2026 메르세데스-벤츠 A클래스,8.50,2023.7월부터 지금까지 첫 차량으로 잘 이용하고 있어요 시원하게 잘 나가요
2026 메르세데스-벤츠 A클래스,7.67,생각보다 고속주행 연비 괜찮습니다 시속 200까지 밟아본적 있고 입문자용 amg로 너무 만족스러운 주행 잘나가고 밟는 재미가 있습니다. 하지만 생각보다 차체가 낮아 주차장 진입과 방지턱에서의 당황스러움은 아직 불편합니다. 항상 도착지의 주차장을 생각해야하고 경사진 후면주차와 각도가 빡신 주차장의 진입 시도는 접으셔야합니다
2026 메르세데스-벤츠 A클래스,8.17,앰비언트라이트 항공모터송풍구 일체형계기판 등 낮에는 물론 밤에도 디자인에 감성까지 훌륭하고 여자 혼자 강아지랑 드라이브 다니기엔 이보다 더 좋을 수 없습니다. 고속주행 시 정말 안정적이고 150대까지 밟았는데도 차체가 가벼워 밟는대로 잘 나가고 특히 스피드 모드에서는 운전이 재밌습니다. 차가 작아 주차하기에도 편하고 서울도심 주행 시 최곱니다. 하지만 아직 2만5천도 안됐는데 2만넘어가니 슬슬 dct 꿀렁거림이 느껴지고 엔진 스티어링 휠 덜덜거림이 느껴집니다.. g80풀옵이 메인인데 이거랑은 비교가 안됩니다. 고급세단이긴 하지만 내장시트 감촉부터 운행시 승차감이 현저히 제네시스가 월등합니다 ㅜ 하지만 내부 디자인은 벤츠a클이 승..예쁜게 다해요.
2026 메르세데스-벤츠 A클래스,9.00,"엔진은 최고,디자인도 최고...그치만 옵션은 gg. 국산차 풀옵타다가 바꾼지 4년됐는데 핸따 안되고 냉풍시트 안되고...스위치들 불편하고...아무튼 그렇다ㅋ"
2026 메르세데스-벤츠 A클래스,9.50,A35에서 A45S 기변입니다 솔직히 벤츠A클이 내려쳐진 현재 평가에 비해 가성비든 뭐든 정말 엄청나다는거를 오너분들이라면 다 알고계실겁니다 운전아마추어를 위한 4matic+덕에동급타브랜드보다 훨씬 안정적이게 주행퍼포먼스를 뽑아낼수도 있고요 근데 이거살거면 M2가 감가가 압도적으로 방어잘되는거 생각하면 M2가 사실상 더싼데 왜사냐고요? 몰라요 그냥 벤츠가 겁나이뻐요 나도아니까그만물어봐
2026 메르세데스-벤츠 A클래스,9.67,차가 엄청 잘 나가요. 고속에서 주행안정성도 좋고 전반적으로 엄청 조용하고요. 타면 탈 수록 엄청 더 만족하면서 타고 있어요. 완전 최고!
2026 메르세데스-벤츠 A클래스,2.33,수시로 엔진경고등이 떠서 여러차례 수리했고 또 언제뜰지몰라 불안해서 타고다니기 불안해요
2026 메르세데스-벤츠 A클래스,10.00,"AMG A35 Facelift 모델 리뷰 ■ 장점 1. 디자인: 페리되면서 AMG 파나메리카나 그릴과 AMG 아팔터바흐 배지 적용되었고, 범퍼 디자인도 바뀌어서 차가 작지만 스포티한 고성능 차량임을 잘 보여줌. 실내도 AMG 스티어링 휠과 알칸타라 시트&빨간 안전벨트가 예쁨. (와이프가 이뻐서 좋아함) 2. 주행성능: 306마력 40.8토크로시원하게 치고나가는 운전하는 재미. 4matic 적용으로 고속주행 및 코너링에서 바닥을 쥐고 가는 안정적인 느낌. 3. 범용성: 컴포트 모드에서 승차감도 좋고 일상에 무난하게 타기 좋음. 48볼트 마하 적용되서 고속주행시 연비 15 km/L이상 나옴. ■ 단점 1. 저단 꿀렁거림 현상: 가다서다 막히는 길 1-2단 변속 시 꿀렁거림 현상 있음. 2. 낮은 지상고: 페리모델은 좋아졌지만, 일반 세단에 비해 낮은편이라 방지턱, 급경사 만나면 30km이하 주행 필요. 아파트 주차 스토퍼에 딱 붙이면 리어 스포일러랑 1cm 남음(파손 위험)"
2026 메르세데스-벤츠 A클래스,9.83,벤츠니까 일단 디자인 이미지 승차감 나쁘지 않습니다. 그래도 비엠이랑 제네시스랑 비교해보고 고르세요!
2026 메르세데스-벤츠 A클래스,9.00,동네 마실용으로 경차보다 오히려 좋은거 같아요 좋아요 조하아어ㅓ아아아ㅏ아아ㅏㅇ
2026 렉서스 UX 하이브리드,9.50,혼자타고다니기 너무좋아요. 연비좋고 잘나가고 고장없고 두번째 렉서스인데 완젼만족합니나.
2026 렉서스 UX 하이브리드,9.50,"출퇴근용 차+ 첫차로 강추합니다! 아담해서 초보 운전이 여기저기 끌고 다니기에 좋아요 . 렉서스 잔고장 없는 건 말 할 것도 없고 (서비스 센터 오고가는데에 정신적 스트레스가 심하다는 걸 옆에서 지켜본 사람으로, 애초에 다른 브랜드들은 생각하지도 않았습니다.) 시내용으로 정말 강추해요! 패밀리카로는 글쎄요. 2열과 트렁크가 좁아서, 솔직히 비슷한 가격대면 선택지가 다양해서 내부 공간을 중요시 여기시는 분은 다른 브랜드 또는 예산을 높여 렉서스 다른 모델을 추천합니다 ."
2026 렉서스 UX 하이브리드,9.83,정말 좋은 차예요. 만족합니다. 연비도 정말 좋습니다. 기본이 20입니다.
2026 렉서스 UX 하이브리드,9.00,"디자인이나 주행, 잔고장 없는 점은 좋으나 내부 터치 패드 사용성은 조금 불편함"
2026 렉서스 UX 하이브리드,9.67,"일단 차가 이쁨, 그거하나로 충분함. 차가 작다는 의견도 많지만 4인 가족이 타기에는 좋음."
2026 렉서스 UX 하이브리드,9.83,"1년정도 타고 있습니다. 디자인, 내구성, 연비 다 훌륭해요. 키 185가 넘어가도 탈만합니다."
2026 렉서스 UX 하이브리드,7.17,가성비가 떨어지고 팔아 버릴까 고민중 착좌감 하나 괜찮고 ...별로
2026 렉서스 UX 하이브리드,10.00,"연비 good, 승차감 good, 디자인 good, 1인 캠핑 good, audio soso, trunk soso"
2026 렉서스 UX 하이브리드,9.67,"첫차로 최고! 서울에서 막히는곳만 다니는데도 연비 17이 나오고 고속도로에 가면 25이상이 나옵니다 4륜이라 눈길에서도 다른차들 다 미끄러질때 안전하게 지나갈 수 있었고 절대 질리지 않는 외형을 가지고 있습니다. 너무 튼튼해서 사고가나도 상대차는 심각한데 내차는 플라스틱 범퍼에 기스나는 정도이고 강남에서 발렛 해주시는 분이 갑자기 엄지척 하시더니 이차가 타본 차중 가장 부드럽다고 하신적이 있습니다. 단 한번의 잔고장도 없었고, 차가 작아서 서울 운전 및 주차에 최고입니다. 유일한 단점은 뒷자석이 좁고 트렁크가 작습니다. 둘이서 타기에는 뒷자석 눞혀놓으면 아주 넉넉해서 너무 잘타고 다녔고, 코로나시절에 차박도 많이했습니다. 하지만 이제 애가 생기니 큰차가 필요해서 이 차는 팔기는 좀 아깝고 와이프랑 애랑 둘이 탈때만 쓸 것 같습니다."
2026 렉서스 UX 하이브리드,8.00,극강의 연비와 잔고장이 제로에 가까운 차 높은 신뢰도로 맘 편히 타고다니고 있어요
2026 렉서스 UX F 스포츠 하이브리드,9.50,혼자타고다니기 너무좋아요. 연비좋고 잘나가고 고장없고 두번째 렉서스인데 완젼만족합니나.
2026 렉서스 UX F 스포츠 하이브리드,9.50,"출퇴근용 차+ 첫차로 강추합니다! 아담해서 초보 운전이 여기저기 끌고 다니기에 좋아요 . 렉서스 잔고장 없는 건 말 할 것도 없고 (서비스 센터 오고가는데에 정신적 스트레스가 심하다는 걸 옆에서 지켜본 사람으로, 애초에 다른 브랜드들은 생각하지도 않았습니다.) 시내용으로 정말 강추해요! 패밀리카로는 글쎄요. 2열과 트렁크가 좁아서, 솔직히 비슷한 가격대면 선택지가 다양해서 내부 공간을 중요시 여기시는 분은 다른 브랜드 또는 예산을 높여 렉서스 다른 모델을 추천합니다 ."
2026 렉서스 UX F 스포츠 하이브리드,9.83,정말 좋은 차예요. 만족합니다. 연비도 정말 좋습니다. 기본이 20입니다.
2026 렉서스 UX F 스포츠 하이브리드,9.00,"디자인이나 주행, 잔고장 없는 점은 좋으나 내부 터치 패드 사용성은 조금 불편함"
2026 렉서스 UX F 스포츠 하이브리드,9.67,"일단 차가 이쁨, 그거하나로 충분함. 차가 작다는 의견도 많지만 4인 가족이 타기에는 좋음."
2026 렉서스 UX F 스포츠 하이브리드,9.83,"1년정도 타고 있습니다. 디자인, 내구성, 연비 다 훌륭해요. 키 185가 넘어가도 탈만합니다."
2026 렉서스 UX F 스포츠 하이브리드,7.17,가성비가 떨어지고 팔아 버릴까 고민중 착좌감 하나 괜찮고 ...별로
2026 렉서스 UX F 스포츠 하이브리드,10.00,"연비 good, 승차감 good, 디자인 good, 1인 캠핑 good, audio soso, trunk soso"
2026 렉서스 UX F 스포츠 하이브리드,9.67,"첫차로 최고! 서울에서 막히는곳만 다니는데도 연비 17이 나오고 고속도로에 가면 25이상이 나옵니다 4륜이라 눈길에서도 다른차들 다 미끄러질때 안전하게 지나갈 수 있었고 절대 질리지 않는 외형을 가지고 있습니다. 너무 튼튼해서 사고가나도 상대차는 심각한데 내차는 플라스틱 범퍼에 기스나는 정도이고 강남에서 발렛 해주시는 분이 갑자기 엄지척 하시더니 이차가 타본 차중 가장 부드럽다고 하신적이 있습니다. 단 한번의 잔고장도 없었고, 차가 작아서 서울 운전 및 주차에 최고입니다. 유일한 단점은 뒷자석이 좁고 트렁크가 작습니다. 둘이서 타기에는 뒷자석 눞혀놓으면 아주 넉넉해서 너무 잘타고 다녔고, 코로나시절에 차박도 많이했습니다. 하지만 이제 애가 생기니 큰차가 필요해서 이 차는 팔기는 좀 아깝고 와이프랑 애랑 둘이 탈때만 쓸 것 같습니다."
2026 렉서스 UX F 스포츠 하이브리드,8.00,극강의 연비와 잔고장이 제로에 가까운 차 높은 신뢰도로 맘 편히 타고다니고 있어요
2026 랜드로버 레인지로버 이보크,8.67,디자인! 그거 하나만 보고 구입 & 만족. 차량 성능? 기술력?? 그런거 잘 모름. 엔진룸 열어봐야 뭐 아는게 있어야 열어보지.. 전혀 모름. 정비는 정비 전문가에게 맡겨드리는게 저에겐 정답.
2026 랜드로버 레인지로버 이보크,7.83,아무리 랜드로버 차량 말이 많더라도 타보면 진가를 압니다 suv차량 승차감 최고이고 디자인엔 할말이없네요 안타본사람들이 말들이 많은차 그러면서 타보고싶지만 못사는차 입니다
2026 랜드로버 레인지로버 이보크,9.17,솔로 혹은 부부만 이용한다면 1. 디자인 최고 2. 주행의 안전을 생각하면 적극 추천 만족하면서 6년째 이용중
2026 랜드로버 레인지로버 이보크,9.00,레인지로버 타면서 가성비 따질건 아니고 스포츠가 더 싸고 크기도 커요 하지만 이보크를 선택한 이유는 타보면 알아요 1세타다 얼마전 2세대 25년식 구입후1056km넘어서고있는데 2세대는 1세대에비해 모든면에서 훨씬 더 탁월합니다
2026 랜드로버 레인지로버 이보크,8.33,"고급스럽고 독보적인 디자인! 뛰어난 승차감과 풍부한 옵션! 차체 대비 비싼 차량가격과 연비, 차선이탈등 안전사항 옵션 성능은 아쉬움."
