car,score,content
2026 BMW X5,8.83,"X5 라는 차 명성에 맞게 전체적으로 모두 훌륭합니다. 다만 외관에 비해 좁은 실내와 몇몇 가격대비 원가절감 소재들이 조금 아쉽습니다. 3.0 디젤 치곤 연비는 만족합니다. 잘 달리고 시원하게 다녀도 기본 11~13 나오고 고속도로 정속주행시 15 이상 나옵니다. 3.0 6기통이라 소음도 거슬리는 수준 아니고 디젤 초반 토크로 힘있는 가속도 마음이 듭니다. 가격이 이미 1억이 넘어서 가성비 차량이라곤 할 수 없으나 운전자가 즐거운차, 패밀리카면서 즐거운차인건 틀림없습니다."
2026 BMW X5,9.83,"1억대 외제 SUV중 실키식스 엔진 기반으로 한 압도적인 주행성능,주행질감,연비, 승차감,하차감 모두 좋습니다! 일단 타보세요.. 디젤이지만 마하로 인해 조용하고 연비도 높여주고 출력에도 살짝 도움이됩니다!"
2026 BMW X5,7.50,"45e 모델을 타다가 전손으로 50e 다시 구매하여 타고 있다보니 45e 보다 원가절감 부분이 많이 느껴지네요. 고전압배터리 업으로 총마력과 주행거리는 늘었지만 더욱 허접해진 엠비언트, 실내 트림 구성,헤드라이트 등등 더욱 좋아진게 아니라 안좋아진 것만 보이네요. 배타리 충전 모드도 사라지고… 회생제동은 너무 급브레이이고.. 출력이나 주행거리는 만족하나 아무래도 나빠진 점이 주행할때 느껴지는게 아쉽네요."
2026 BMW X5,9.33,"SUV 정석, 최고의 차량 연비는 약 9km/L정도임. BMW 엔진성능이 최고"
2026 BMW X5,9.33,디자인이야 X5답고 성능면에서는 단연 최고인것같아요. 특히 8기통에서 나오는 엔진 사운드는 남자들이라면 다들 좋아할거 같습니다.
2026 BMW X5,9.17,다좋으데 뒷자리 시트가 고정되서 불편 한거 같네요 시동이 걸려 있는 상태에서 운전석 문을 열면 시동이 자동으로 꺼지는 기능은 안좋은것 같아요
2026 BMW X5,9.33,14년식 5시리즈 타다 넘어왔는데 넘어오기 전에 와이프와 다른 브랜드들의 동급 차량을 시승해본 후 결정한게 X5!!! 확실히 bmw만의 주행감은 익숙함과 동시에 느껴지는 핸들 조향의 안정감은 와이프와 의견일치 되는 유일한 차량이었음. 개인적인 bmw의 단점이라고 생각해왔었던 실내의 변화가 더디고 올드하다는 생각을 가지고 있었는데.. 생각외로 많은 내부 기능들이 추가되었고 변화된 요소들이 많아 신기능들 알아가는 재미가 너무 즐겁네요~ 구매 전에도 많은 리뷰들을 교차허며 검토했었지만 왜 X5가 인기가 있을 수 밖에 없는지 핸들을 잡을때마다 느껴집니다. 전 다음차도 고민없이 x5를 선택할 것 같아요.
2026 BMW X5,9.33,"주행성, 정숙성 실용성 등 모든 면에서 만족하고 타고 있습니다. SUV 교과서라는 말이 괜히 나온 것이 아니죠."
2026 BMW X5,10.00,최강의 아빠차 크윽 스포츠카 부럽지않는 성능 혼자 스포츠모드 쏘고싶을때 굿 아이가 탓을땐 얌전한 하드하면서 에어서스의 부드러움
2026 BMW X5,8.67,M60i 운행중입니다. 차 탈 때만 기다려지네요. 많이 조용해 졌다고 해도 운전 할 때 8기통의 그릉대는 소리는 가슴을 설레게 합니다. 40대 초반이라 x7 보다는 x5로 선택했어요. 뒷좌석 폴딩이 없는 부분이 아쉽지만 메리노 양가죽과 잘 정돈된 가죽 실내를 보면 너무나 기분이 좋아집니다. 연비는 고속도로 100-110 크루즈 기준 11정도인데 밟는 순간 ㅠㅠ 7 각오 해야합니다. m60i는 그릴에 아이코닉 라이트 들어오지 않아서 조금 심심하고 가격이 8기통 대형 suv라고 생각하면 비싼지 가성비가 있는 지 헷갈립니다. 코너링 시 모터가 반대쪽으로 차를 밀어줘서 수평 유지 잘 되구요 뒷바퀴 조향 또한 탁월합니다.
2026 BMW X5,9.50,수입차는 처음인데 디자인도 마음에 들고 주행성능이 뛰어납니다. 2열 공간은 살짝 아쉽습니다.
2026 BMW X5,8.67,주행감 빠릿하고 적당히 딱딱함 이로인해 고속안정성과 코너링이 탈SUV급 연비도 고급유 넣으니 10키로초반대 유지중 뒷열음 참 좁음 ㅠㅠ 이건 제네시스가 압승 센터페시아 바뀐것도 아쉬움..
2026 BMW X5,9.83,운전하는게 정말 즐겁습니다 차 크기에 비해 놀라울 정도의 주행성능 Suv 중에 최고라고 생각합니다
2026 BMW X5,8.67,좋은차입니다 패밀카로 적합합니다 국산차에비하면 좁은편입니다. 풍절음이 조금 있습니다
2026 BMW X5,8.83,BMW를 대표하는 SUV답게 잘 만든 차다. 하지만 AS 부분은 타사에 비해 매우매우 아쉽다.
2026 BMW X5,10.00,넘사벽 suv 기준인게 분명함 타보면 압니다.
2026 BMW X5,9.00,주행감 성능 뭐하나 빠지는거 없고 8기통 엔진의 감성은 최고임 연비가 안나오지만 매번 쏘는거 아니므로 유일한 단점??
2026 BMW X5,9.00,최고의 SUV 만족도가 아주 높습니다. 담에도 X5 가고 싶네요.
2026 BMW X5,10.00,말이 필요없는 최고의 패밀리형 SUV 7인승으로2열 등받이 각도 추가조절은 강추입니다.
2026 BMW X5,9.17,"1. 주행성능 = 'SUV는 BMW를 사야한다'라는 말이 왜 나오는 지 알 수 있는 SUV답지 않은 주행성능입니다. 높이가 있지만, 롤도 확실히 다른 SUV에 비해 적어서 차체가 바닥과 수평되어 움직여줘서 코너링 시에 기분이 좋습니다. 2. 연비 = 상시 충전이 가능한 분이고, 왕복 출퇴근 거리가 50km 이내라면 전기로만 출퇴근이 가능합니다. 장거리 여행 시에도 평균 14km/L정도 나오는 것 같아요. 3. 거주성 = 차 크기에 비해 실내는 확실히 좁습니다. 옆으로는 널찍하나, 앞뒤로는 조금 좁지 않나? 라는 생각이 종종 듭니다. 그리고 문짝이 두꺼워서 주차하고 타고 내릴 때 힘듭니다. ㅎㅎㅎ 4. 디자인, 품질 - 디자인은 두말할 것 없이 정말 마음에 드는 부분이며, 품질도 잡소리 없이 깔끔하여 만족합니다."
2026 BMW X5,8.33,1억초반 가격대 suv에서 대체불가 라고 생각듬 . 그와중에 Gv80갖다 붙이지좀 말자.. 에어서스가 없는 순간부터 비교대상이 아니다.
2026 BMW X5,8.67,마일드하이브리드지만 연비는 생각보다 안나옴
2026 BMW X5,7.50,생각보다 기름을 좀 먹어요 나머지는 나름 만족합니다 뒷자석은 생각보다 많이 불편합니다
2026 BMW X5,9.67,"차 크기에 비해 실내 공간이 조금 작게 느껴지는 것 말고는 모든 것이 만족스럽네요. 기름, 전기 완충하고 부산 다녀오는 것도 전혀 문제 없을 듯 합니다."
2026 BMW X5,9.83,정말 모든게 완벽 그자체... 100프로 성능을 가끔 느끼려고 스포츠를 종종 두고 타니 연비는 똥망.. 이지만 정말 그외 모든게 완벽!!!!
2026 BMW X5,9.67,가격 연비빼고는 성능 및 편의성에 최고의 차량입니다 만족도 높아요
2026 BMW X5,10.00,Good good very good Good good very good
2026 BMW X5,9.67,싼타페 타다 넘어왔더니.. 차가 이럴 수 있구나..이러니 살수 밖에 없구나 라는걸 한참 느끼는 중 이에요.
2026 BMW X5,9.33,"재규어F페이스라는 차를 타다가 2023년말 허리통증과 잦은 전자기판 고장으로 옮겨 탔는데 허리도 정말 안 아프고, 왜 이제서야 이걸 타게 됐는지 생각을 하게 됐습니다. 당시에 카이엔쿠페와 고민하다 가족을 위해서 X5로 결정했지만 후회는 없고요 SUV를 구매하신다면 X5는 꼭 한번 옵션에 넣어서 고민해보셨으면 좋겠습니다 JL그룹... 보고 배웁시다 좀."
2026 BMW X5,9.67,주행성능좋고 디자인 좋고 패밀리카로서 손색이없네요. SUV 는 X5만한게 없는 것 같아요
2026 BMW X5,9.50,말이 필요 없습니다. 이 급이서는 여유가 된다면 X5 입니다. 실키식스의 부드러운 엔진 필링과 차 사이즈가 느껴지지 않는 핸들 코너링 아직 길들이기 중인데 탈때마다 감탄합니다~
2026 BMW X5,8.67,6기통이라 주행이 부드럽고 엔진소음이 거의 없습니다. 반면에 마일드하이브리드라 연비도 9.5km/l 정도는 나오는 것 같습니다. 다만 에어서스가 조금 통통튀는 듯한 느낌이 있습니다. 또 서비스센터 퀄리티가 불만족스럽습니다. 에어카플레이 연결이 조금 불안합니다.
2026 BMW X5,9.00,전체적으로 우수함 플러그인 하이브리드의 유용성이 좋음 다만 엔진체크등이 자주 뜸
2026 BMW X5,9.33,주행 성능은 말할거도 없고 덩치에 비해 연비도 만족 스럽고 4인기준 실내 거주성이 편하고 디자인은 포스 좔좔에 차량인도후 품질은 미국 생산이라 그런지 조금 아쉽다
2026 BMW X5,10.00,"차무게에 비해 날렵하니 출력도 좋고, 코너링 고속주행등 안정감도 좋아요 불편함없이 편안하고 만족하면서 타고있어요"
2026 BMW X5,9.67,차 너무좋음!!! 강추입니다!!!!!!!!!!!!!!!!!!!!!!!!!!
2026 BMW X5,10.00,더 말로 할 설명이 필요없을 정도로 매우 훌륭합니다. 엄청난 정숙성과 미끄러지듯 나가는 주행. 디자인은 말할것없이 멋집니다. 특히 뒷모습은 최고가 아닐까 합니다. 2.4톤이나 되는 무게임에도 불구하고 평균 10km/L넘는 연비는 엄청납니다. 고속만 주행한다면 15까지도 나오네요. SUV를 고민하고 계시는 분이 계시다면 고민말고 선택하시면 될것같습니다.
2026 BMW X5,9.33,디젤차량이지만 이산화탄소 배출량이 동급의 가솔린 차종보자 낮은데다 실제운행 연비는 13.2km/l 까지 나오는걸 보면 성능이 뛰어난 차입니다
2026 BMW X5,9.50,주행성능 디자인 최고입니다 트렁크가 좀 작은게 흠ㅡㅡ 캐디백 가로로만 들어갔어도...
2026 BMW X5,9.00,"X5 50e 스페셜에디션이라 올블랙 포스에 타르투포 시트, B&W스피커, 가죽 대시보드, 후륜조향 들어간 모델이라 모두 만족합니다. 물론 그래서 할인도 적고 가격도 비쌌지만 1.4정도 가격대에서는 매우 훌륭한 선택지라 생각합니다. 중량이 있다보니 연비는 좋은 편은 아니지만, 전기로 100키로 이상 갈 수 있다보니 장거리 여행 아니고는 주유소에 갈 일이 그닥 없네요. 2열 거주나 트렁크 용량은 차체에 비해 넓진 않지만 나머지 장점들이 이를 상쇄해주고, 전기차처럼 타다가 원할 때는 500마력 가까운 힘을 내어주는건 다른 차종에서는 경험하기 어렵습니다. 수요가 몰리는데는 이유가 있는 듯!"
2026 BMW X5,9.50,큰 차를 운전하고 있다는 생각이 들지 않을 정도로 차가 참 경쾌합니다.
2026 BMW X5,9.67,시야만 높아진 세단 타는듯한 편안한 승차감. 밟는대로 즉각 반응하는 성능. 나쁘지 않은 연비. 고급유 찾아다녀야 하는 번거로움이 유일한 단점.
2026 BMW X5,9.17,연비 좋고 치고 나가는 맛이 있는 SUV 차량치고 코너링 및 주행 안정성 우수. 가격만 빼면 나무랄데 없는 차량입니다.
2026 BMW X5,7.17,밴츠에 비해 운동성능이나 옵션은 좋은것 같습니다 단 페이스리프트전과 후 가격상승이 컸고 아이드라이브8.5오류가 종종 발생 했습니다 1억3천이 넘는 차인데 천장이나 썬바이저가 가죽이었음 하는 아쉬움이 있네요 그래도 이가격대 suv중 왕좌의 자리를 굳건히 지키는 차량이라 생각합니다
2026 BMW X5,9.67,"패밀리카로 아주 좋네요 주행성능은 말할 필요도 없고, 승차감좋고 연비도 생각보다 좋음"
2026 BMW X5,10.00,이만한 가격에 가족들과 안전하게 타고 당길만한 차는 없는것 같습니다 나중에 다시 차를 바꾸더라도 X5로 살것 같아요
2026 BMW X5,9.33,믿고 타는 X5죠 드라이빙은 말할 것도 없고 실내공간도 수입치 치고는 괜찮아요 다만 가격이 후덜덜하다는게 유일한 단점이지 않을까 합니다
2026 BMW X5,7.83,마일드 하이브리드 전기차 등으로 넘어가기 전 모델이라 그런지 기본기가 탄탄합니다
2026 BMW X5,9.33,핸들이 약간 가볍긴하지만 승차감이 좋고 편한합니다. 다음에 사도 이차로 할듯
2026 BMW X5,8.00,"디자인이나 정숙성 및 치고 나가는 운동능력은 좋습니다. 하지만 2열 공간이 부족하고, 생각보다 연비가 잘 나오지 않습니다. 그 부분 제외하고는 만족합니다."
2026 BMW X5,9.83,아주 좋은차임.... 다만 애플카플레이가 수시로 끊어져서 불편함. 정말 주행성능 좋은ㅊ
2026 BMW X5,8.83,2022년식 xline 다자인 거주성 주행성능은 매우만족. 깜빡이 스치치와 소리 경작소리는 별로. 그리고 고질적인 핸들소음... 연비는 고속도로 70%인데 실연비 11~12정도 하지만 게기판엔 13~14이상으로 나옴. 안드로이드오토 불안정
2026 BMW X5,9.83,트렁트 크기가 생각보다 작다. 2열 레그룸이 차 크기에 비해 작지만 불편한 정도는 아니다. 그 외는 모든 부분이 만족스럽다.
2026 BMW X5,8.17,다좋은데 1. 무선 애플카플레이 안드로이드오토 연결이 넘 불안하다. 2. 아래등급 모델과 차별성이 미미하다. 이정도가 불만~~~
2026 BMW X5,9.83,이 가격대비 동급 최고가 아닐까 싶네요 suv답지 않은 승차감..플러그인 하이브리그라 연비 엄청나요 ㅎ 벤츠 gle와 비교 많이했는데 선택 잘한것 같아요 ㅎ 단지 트렁크가 좀 작은듯한데 골프백 4개가 안실릴것 같아요 ㅎ
2026 BMW X5,9.33,공회전시 잔진동 빠른템포로 올라오는거 빼고 주행중에는 주행질감 핸들링 가속감 다 만족합니다.
2026 BMW X5,9.33,"최고장점인 100km전기모드 가능한 하이브리드~ 달리고 싶을때 쭉쭉 뻗어주는 출력~ 자율주행도 생각보다 좋고 활용도가 높음!! suv라 승차감은 기대 안했는데 요철 등에서 흔들림도 잘 잡아주고 굿굿 굳이 단점을 꼽자면.. 출퇴근 거리가 멀어서 매일 전기 충전해야 되야하는 점과 디테일이(앞문 배수로 마감, 구석진데 용접마감 등)이 깔끔하진 않음"
2026 BMW X5,10.00,주행성능 좋고 ~ 에어서스의 편안함과 단단한 하체에서 오는 만족도가 정말 높은 차 입니다!
2026 BMW X5,9.33,디자인.주행성능.다 좋은데.. 수리기간이 너무 오래걸려요.. 사고로 인해 수리기간은 정말 다시 타고 싶지 않네요~
2026 BMW X5,10.00,"주행성능, 디자인, 연비, 승차감.. 거기에 하차감까지.. 100% 만족하고 탑니다. 나이 좀 더 들어서 오픈카 타고 싶은 생각도 있지만 ^^ 지금은 너무 만족하고 타고 다닙니다."
2026 BMW X5,9.17,"차 크기보다는 실내가 좁게 느껴지는면이 있지만 타다보면 불편함 없이 적응됨. 수납이 약간 부족하지만 이것도 적응이 됨. 트렁크가 좀 작은편. 디자인, 승차감, 연비는 만족. 6기통 마일드하이브리드는 디젤의 혁신인듯."
2026 BMW X5,10.00,"에어서스,헤드업디스,소프트클로징,레이져라이트 등등의 옵션! 월등한 엔진성능!레인지로버 스포츠와 같은 엔진으로 엄청난 퍼포먼스와 안정적인 승차감입니다. 이런 옵션과 엔진으로 동급 자동차를 사려면 최소 몇천만원 차이가 나네요. 마일드하이브리드로 인하여 연비는 평균12키로 시내주행으로 한번 주유시 1000km갑니다. 직접 느껴보세요. 국산차 동급으로 해도 1억들어가네요."
2026 BMW X5,9.67,평소 전기로만 시내주행은 최고입니다. 고속주행시 연비도 잘 나오는 편입니다.
2026 BMW X5,9.67,세단이 필요없음 만능 좋아요 엄청 좋아요 가성비 끝판왕 한국차량 넘 비싸요
2026 BMW X5,9.67,msp pro 디자인 너무 좋습니다 6기통에 무게도 많이 나가지만 연비도 정말훌륭합니다 차 만듬세가 좋습니다
2026 BMW X5,9.33,좋아요 만독하고 질리짖않는차! 오래오래 타도 좋을거같아요 역시 x5. 45e. 전기 감성도 너무좋음
2026 BMW X5,10.00,패밀리카 & 주행성능 등 모든게 마음에 들어요 완충시 90~100km 가능하기에 일상 생활에서 전기만으로 운행 가능해요
2026 BMW X5,8.67,충전만 잘된다면 좋음 장거리갈때 전기 걱정없어서 좋음 비싸서 돈만잇으면 좋음
2026 BMW X5,10.00,1억짜리 차 구입예정이고 차 잘모르면 x5사자 중간은 간다 짱짱함 포스있음
2026 BMW X5,10.00,"일반 X5 30d, 40i 와는 완전 다른 차라고 보면 됨 전기차의 장점과 내연기관의 장점을 모두 갖춘차임. 또한 전기차의 단점과 내연기관의 단점을 모두 커버하는 차이기도 함. 약 1억 중반대의 가격으로 전기모터로 인해 X5M보다 빠른 초반 가속력으로 마치 M을 타는 듯한 착각을 불러올 만큼 탄성을 자아내는 드라이빙 퍼포먼스를 보여주며 M의 기름귀신 똥망연비를 플러그인하이브리드라는 극가성비연비로 커버해 주는 실용성까지 갖춘 차량으로 부드러우면서도 강력한 힘을 지닌 BMW의 역대급 실수로 나온차가 아닐싶음. 암튼 일단 타봐야 그 진가를 아는 차임."
2026 BMW X5,8.67,역대 비엠 중 내 외관의 디자인은 최고이며 주행성능은 말해뭐해죠. 쭉쭉 나갑니다. 승용차 대비 뒷자리에서 큰 아이가 멀미를 잘타는거 빼곤 대체로 만족합니다.
2026 BMW X5,9.50,페밀리카로 승차감과 성능을 함께 만족시켜주네요. 벤츠와 비교해보다 결국 BMW가 기능면에서 좋다고 생각되어 샀는데 후회 없이 타고 있어요.
2026 BMW X5,9.00,주행성능 가격대비짱인듯합니다 전에 차 팰리세이드인데 거주성외 압도 근데 가격도압도 ㄷㄷ
2026 BMW X5,9.50,승용차 포함 1.3억에 구입가능한 최고의 자동차라 생각합니다. 주행성능 차고 넘치고... suv스럽지 않는 미친 주행감... 강추 합니다.
2026 BMW X5,8.33,그럭저럭그럭저럭그럭저럭그럭저럭그럭저럭그럭저럭그럭저럭그럭저럭그럭저럭그럭저럭그럭저럭그럭저럭
2026 BMW X5,9.67,가격을 제외한 모든 면에서 완벽하다. 하이브리드라서 유지비가 강점. 주행성능은 최고. 3년타고나니 이제 50e로 가고 싶네.^^
2026 BMW X5,9.33,로망의 차량이라 매우만족하며 운행하고 있습니다. 그러나 서비스측면에서 불편한점이 많습니다.
2026 BMW X5,8.67,M Performance 차량이고 8기통이라 연비는 6-7km 정도 나옵니다. 차는 확실히 잘나기고 잘 섭니다. 뒷바퀴 조향이 있어 운전도 편안 하구요
2026 BMW X5,8.17,디자인 40i Msp LCI버전 매우 만족합니다 주행성능 이보다 우수하고 좋은차 물론 많이 있지만 제입장에선 매우 만족합니다
2026 BMW X5,10.00,괜히 더 보스가 아닙니다. 너무 만족하면서 타고 있습니다. 잡소리가 좀 있었지만 센터에서 잘 조치해 주셨습니다.
2026 BMW X5,9.33,"3.0 엔진이라 주행성능은 우수 그로써 연비는 별로라하지만 국산 3.0대비 효율이 좋아요 보통 9-11나오는듯~~??(운전 스타일 얌전) 공간성 넓하니 좋으나 그만큼 차가 뚱뚱하다보니 주차가 조금 빠듯함 다자녀로 7인승해서 세금이 110만원정도였던가.. 프로모션과 재구매결합으로 9천대차량으로 이만한게 없습니다~ 에어서스의 고급감이... 승용차보다 좋게느껴지긴한데 뒤뚱거리는건 극복하기 힘들수밖에 ㅠ (suv한계) 3열시트는 아이들 놀이터 근거리시 아이들 2,3열에 5명도 가능하니 좋아라합니다 패밀리카로 우수! 안전성. 충돌테스트 탑티어급이죠~ 주행성. 훌륭 단점은 비쌈과 2.0대비 떨어지는 연비"
2026 BMW X5,8.50,내연기관에서 전기로 넘어가는 과도기에 구매한 차량인걸 제외하면 아주 흡족합니다
2026 BMW X5,9.33,플러그인 하이브리드라 시내운전에 충전하면 편하게 전기차로 다니니 조용하고 전반적으로 아주 만족합니다. 다만 배터리 때문에 트렁크공간이 좀 좁은 편입니다.
2026 BMW X5,8.67,"부드러운 주행감,때릴땐 빠르게 때려주는 펀치력..최고의 차. 시내주행 연비는 개사악하지만 고속도로는 탈만함"
2026 BMW X5,9.67,플러그인 하이브리드 연비로 평소 출퇴근은 전기로만 타고 장거리 가도 왕복 700키로까지는 탈수있는거같아요
2026 BMW X5,9.00,"LCI후 디자인과 전기주행거리, 충전속도가 2배 빨라져 더 좋아졌습니다."
2026 BMW X5,9.83,이차만큼 모든걸 충족하는 차가 있을까? 싶어서 구매하였는데 포르쉐SUV는 안타봐서 모르겠지만 동급중에는 최고네요.
2026 BMW X5,9.33,"비용적인 문제(구입비용, 유지비)를 제외한다면 현존 suv 중 거의 최고의 차량이라 생각합니다. 디자인과 거주성, 운전성능에 있어 최고의 만족감을 줍니다"
2026 BMW X5,9.33,"주행성능, 편의성 좋고 탈만합니다. 주행성능, 편의성 좋고 탈만합니다. 주행성능, 편의성 좋고 탈만합니다."
2026 BMW X5,9.67,고급유 주유 연비 이정도 크기에 만족합니다. 승차감은 엄청나게 좋다기보다 suv치고 나쁘지 않아요 만족합니다. 다음차량도 x시리즈로 가야겠단 생각입니다
2026 BMW X5,9.67,절묘한 핸들링 탁월한 가속력 바로 꼿아 버리는 브레이크 직접 타봐야 그 진가를 알 수 있다~~~~~~♡
2026 BMW X5,9.67,"플러그인하이브리드 모델로 풀 충전시 약 100k 이상 전기로만 운행이 가능합니다. 출고한지 약 10개월정도 되었는데 연비가 리터랑 70을 찍고 있네요.. 고유가 시대의 팔방미인으로.. 성능, 주행, 디자인 등 전반적으로 너무 만족하고 있습니다."
2026 BMW X5,8.00,연비 신경 안쓰고 크고 듬직한 패밀리카로는 최고입니다! 패밀리카지만 힘도 좋다는거!!
2026 BMW X5,9.00,기본 가솔린 모델만 해도 충분한 성능을 내주는데 거기에 전기모터가 더해져 합산출력 400후반대의 힘을 내면서 무거운 중량이 의미없게 느껴질 정도로 경쾌하게 달려나감. 디자인도 이미 완벽한 디자인을 한번 더 다듬어서 M스포츠 프로 기준으로 보면 더 스포티해 보이면서도 깔끔하게 잘 손본것 같음. 배터리를 완충하면 105~120킬로 정도 실 주행가능한데 이정도면 플러그인 선택할 가치가 충분히 있다고 느껴짐 하지만 5인승 모델 기준으로 실내공간은 똥망수준...투싼 스포티지 급...그래도 완벽한 차~~
2026 BMW X5,10.00,연비 디자인 성능 모두를 만족시키는 패밀리suv 전기+기름 합산 연비 20km 정말 대박인차..
2026 BMW X5,8.33,다양한 차를 많이 타 보진 않았지만 X5 40i 타면서 느끼는건 '진짜 잘 달린다' 입니다. 이 덩치에 어떻게 이런 동력 성능이 나오지 라는 생각이 들 정도로 밟는 족족 튀어 나가는데 고속 운전이 정말 재미있습니다. 고속도로에서 어댑티브 크루즈 컨트롤 활성화 해 놓으면 테슬라 만큼은 아니지만 그래도 상당히 잘 됩니다. 아이 때문에 주로 뒷좌석에 타는 와이프 말로는 뒷좌석에 있으면 종종 멀미가 난다고 하네요.
2026 BMW X5,9.50,"전에 차 쏘렌토 디젤 10년탔습니다. 아내의 응원에 힘입어 6gt와 비교해가며 시승했는데 캠핑다니는 4인 가족으로선 크게 고민을 하지않았고요 . 비교대상이 쏘렌토여서인지 비교조차 x5에 미안해지네요 구매한지 6개월, 운행거리는 출퇴근은 걸어서 하는지라 약 6000정도 됩니다. 매번 탈때마다 감탄을 해요. 아이들 태우며 다닐때는 약간의 할배운전정도 하는데 가끔 혼자 드라이빙 할때는 스포츠 모드에서 느껴지는 부드러운 배기음 아 너무좋아요^^ 에어서스의 부드러움도 나혼자 느끼기에 너무 아쉬워요 ^^ 실내 공간성도 전 차에 비해 좁다는 생각 하지않았고요 트렁크도 이정도면 4인가족 충분히 캠 다닐수 있겠다 싶어요. 물론 경량화를 어느정도 해야겠지만요 현재까지 고급유만 주유하고있는데 집 주변에 주말만 고급유 할인하는곳이 있어 계속 고급유 주유할생각입니다. 40대 중반에 정말 사고싶었던 차를 사게되어 행복감이 더 커졌어요"
2026 BMW X5,9.00,G30 530i 타다가 넘어왔는데 에어서스 때문인지 승차감이 더 좋습니다 주행성능은 실키식스 정말 부드럽고 힘차게 나가서 항상 감탄합니다 저는 컴포트로 타는데 도심 7.7~8.1 정도 연비이고 고급유 주유합니다 진짜 타보면 주행성능 코너링에 와 소리 나옵니다 . 가족도 중요하고 내가 재밌고 즐겁고 싶다 하면 BMW X5
2026 BMW X5,9.33,"이 차급에서 감히 최고라고 말해주고 싶습니다. 카이엔, GLE, 레인지로버 스포츠랑 비교 시승 후 느낀 점은 흔히 말하는 올라운드 플레이어, 육각형 플레이어 같은 차 입니다. 무엇보다 차량 관리가 편하다고 느꼈네요."
2026 BMW X5,9.33,이 큰 덩치로 이런 주향감과 이런 편의사항과 이정도 연비면 딱히 더 바랄게 없는거같습니다
