car,score,content
2026 BMW iX1,9.33,"할인 많이 받고 구매 하니 국산차 EV3 풀옵 이나 EV6 보다 훨씬 저렴하게 구매 가능하고 4륜 풀옵션 이기 때문에 주행 하기는 정말 편리하고 편안합니다 그리고 장점 몇가지를 더 말씀 드리자면 눈길 주행은 역시 전기차가 GOAT 인듯합니다 실내 외부 디자인이 정말 이쁩니다 뒷모습이 정말 마음에 드는부분이고 출력도 304마력으로 빨라서 제로백 5.2초 정도 되고 다른 타사 벤츠 EQB,A , 아우디 Q4 보다는 훨씬 잘나가는 느낌을 주고 있습니다 그리고 전기료 도 지원해주니 1년동안은 무리없이 잘 탈수 있는장점도 있습니다 아쉬운 점은 전기차 이기 때문에 회생제동시 엔진브레이크 처럼 약간 뒤에서 잡는듯한 느낌때문에 허리에 무리가 조금 있습니다 하지만 25년도 차량 부터는 요추받침 도 기본 포함 이기 때문에 상관없을것 같다고 느끼고 또 한가지는 수납공간이 약간 부족하지만 트렁크 공간은 전기차 에 비해 비교적 크기 때문에 크게 문제는 되지 않고 있습니다"
2026 BMW iX1,9.00,최고의 엔트리모델! 매우 귿한 디자인! 매우 심플한 센터페시아! 미니멀리즘에 부합하는 간소함 그 잡채!
2026 BMW iX1,9.83,트렁크는 다소 작지만 실내거주공간은 충분해요. 듀얼모터 제로백 5초대라 나가기는 정말 시원시원하게 잘 나가고 디자인은 동급류 전기차 중에서는 제일 낫다 봅니다
2026 BMW iX1,8.67,"장점: 이쁘고 가속감좋고 편한운전 동급 차량대비 풍부한 옵션 ,저렴한유지비 단점:주행거리,수납공간, 고속운행시 살짝 안전성? 첫 전기차인데 전체적으로 너무 맘에 듭니다 다음차도 전기차 구매해야징"
2026 BMW iX1,9.83,차는 좋음 주행질감이나 옵션등등 모든게 만족스러움 단지 문제는 가격임 할인을 적게 받으면 이돈C 소리가 나오지만 나처럼 할인 받아 5천 초반에 구매할경우 정말 만족하고 탈수있음 주행 거리는 전비 신경안쓰고 적당히 재미 느끼며 탄다면 410정도 나옴 동급 짱츠랑 비교했을시 옵션 주행성능 가격등 뭐하나 빠지는것없이 압승임
2026 BMW iX1,9.67,주행거리가 짧다는 점 딱 한가지가 단점인거같네요 전체적으로 너무 만족스럽게 타고있습니다~
2026 BMW iX1,7.67,준수한 디자인과 주행성능을 가지고 있습니다. 단점은 약간은 아쉬운 주행거리입니다.
2026 BMW iX1,9.83,역시 브랜드 가치가 느껴지네요 편안하게 잘 타고 있어요 무난한 디자인 공간도 생각 보다 넓어요
2026 BMW iX1,9.67,전기차 특성상 매우 경제적이며 성능도 좋습니다 공간이 조금 협소한 편이긴 하나 소형 SUV를 선호하시는 분들에겐 최고
2026 BMW iX1,9.50,가성비 최고의 ev suv라고 생각함 패밀리카로도 무리 없을 정도의 실내성도 갖춤
2026 BMW iX1,7.83,단점 1.수납공긴 부족 2. 무선충전 시스템 발열 3. 냉풍시트 없음 4. 외부방음 취약 장점 1. 전기차 특유의 정숙성 2. 빠른 반응속도 3. 비교적 안정된 전비 4. 단순하지만 세련된 실내 디자인 5. 가속성 및 주행성능의 안정성 6. 고가의 고급차에 밀리지 않는 편의옵션
2026 BMW iX1,8.83,패밀리카로 쓰기위해 바꿨는데 충분할듯합니다 전반적으로 만족할만한 성능을 가지고 있으며 주행거리는 겨울철이외에는 타는데는 무리없습니다
2026 BMW iX1,8.67,"# 장점 1. 등급에 비해 실내공간 넓음. 반면 전장은 길지않아 주차등이 편함 2. 통풍빠진 풀옵션(엉따/핸따/HUD/서라운드뷰/무선오토/무선충전/파노라마 선루프/자동주차/반자율/전동트렁크/메모리전자시트/2열리클라이닝/디지털키 등) 3. 인증보다 훨씬 잘나오는 전비 (에어컨 항상 틀고 다녀도 요즘같은 날씨에 8이상 나오는 전비.. 만땅 채우고 거의 500키로 주행가능) 4. 하만카돈 사운드 꽤나 좋음. 저속/고속 주행시 주행사운드도 굉장히 좋음 # 단점 1. 공조버튼 불편 (물리버튼이 없어 디스플에이에서 조작) 2. 승차감 (일반 주행시는 괜찮은데 방지턱 넘을때 통통 튐) 3. 브레이크 (브레이크 성능이 좋아서 그런다고 하는데.. 부드럽지 않음) 4. 가격 (ix1 이라는 네임에 비해 비싼편인데.. 옵션값인듯?) 운전, 주차하기에 편한 엔트리급 차를 선택하려니 ix1이 딱인듯. 옵션이 거의 다 있어서 모든게 편하고 디자인도 굿이라 만족합니다. (가격만 좀 비쌈ㅋ)"
2026 BMW iX1,9.83,주행거리 제외 아직까지는 단점을 모르겠네요 80프로는 와이프 주행중인데 둘다 만족스럽게 다니고 있어요~ 장거리도 중간 휴게소에서 화장실타임겸 한번 충전하고 다닌다고 생각하니 스트레스는 없습니다
2026 BMW iX1,10.00,"국산 내연기관 suv를 타다 바꿨는데 어느것하나 부족함이 없습니다. 퍼포먼스부터 편의, 주거성까지 이전의 x1과는 차원이 다른 자동차입니다!!"
2026 BMW iX1,10.00,BMW 4번째 구매이고 와이프 차량응로 구입했는데 좋습니디~전체적인 밸런스도 안장적이며~무엇보다 듀얼 모터가 진짜 압권입니다...이로안해 주해거리가 좀(?) 짧지만 풀충전 시 400km 이상나오니 큰 불편함 없네요. 전세대 대비 편의사양도 나쁘지 않고 특히 안전사향은 이전 X3(G01)보다 더 좋습니다 내부는 G바디 X3보다 넓은게 큰 차이네요~ 170cm 고2 고3 4가족인데 불편함 없습니다 할인폭이 큰 프로모션 타이밍 잡는다면 저렴하게 구매가능합니다
2026 BMW iX1,8.83,차량은 총 세번째 외제차는 처음타봅니다. 확실히 운전자 편의기능들은 국산옵션들을 따라올 수 없네요 그래도 필요한것들은 들어있고 주행거리도 공식310은 훨씬 뛰어넘네요 나름 합리적 가격에 남들이 타지않는(그돈씨)지만 긍정적으로 생각하면 우리나라 단 700대도 안팔린 희소성있는 차량입니다:) ㅋㅋㅋ 만족입니다 디자인 실내공간 👍🏽
2026 BMW iX1,9.33,탈수록 마음에 들어요 차 세계의 아이폰 느낌 충전 후 주행거리가 조금 짧은 편이라 아쉽긴 하지만 그래도 집밥이 있어서 아직까지 불편함을 느껴본 적은 없어요 집밥 있는 분들께는 적극 추천입니다
2026 BMW iX1,9.00,재미있게 운전하기좋고 전기차가 유지비가 적계드는게 확실이 매리트가 있습니다
2026 BMW iX1,8.67,"안락한 느낌하고는 거리가 멉니다. 주행거리도 조금 아쉽고요 그러나 디자인, 마감품질, 편리한 옵션들은 매우 좋습니다 ^^"
2026 BMW iX1,9.33,"앞자리 통풍 시트 및 뒷자석 열선 시트가 없는게 아쉬운 부분이고, 또한 주행거리만 500km이상 이었으면 완벽한 차량이지 않을까 생각되네요."
2026 BMW iX1,9.50,차가 일단 너무 예쁘고 주행거리는 살짝 아쉽긴하지만 그래도 돌아다니는데 무리있는 정도는 아니라서 너무 잘타고 있어요!ㅎㅎ
2026 BMW iX1,9.67,주행 거리 아쉬운거 빼고는 완벽해요. 어짜피 집밥 있고 하면 주행거리도 크게 걱정저리도 아니고 조금 아쉬울 뿐. 동급차 대비 완벽합니다. 통풍빼고 풀옵션
2026 BMW iX1,9.50,승차감과하자감좋아요. 힘이좋아서 치고나가는맛이좋아요.첨단보조장치들이있어주차하기편해요
2026 BMW iX1,9.67,"현 시점 동급대비 가장 좋은 선택지라 생각하고, 새차 뽑기 추천합니다. 디자인, 시트포지션, 옵션 등등 뭐하나 빠지는게 없네요 4륜이라서 더 좋은거 같네요 추천드려요~"
2026 BMW iX1,9.17,디자인 이쁘고 하차감 좋고 희소성 좋고 거주성 편의성 주행능력 좋습니다 주행거리는 집밥있으신 분들은 노걱정!
2026 BMW iX1,10.00,깔끔한 디자인의 여러가지 최신 옵션이 다 장착 되어 있고 하만카돈도 포함된 bmw 가성비 전기차
2026 BMW iX1,9.83,"가성비 좋게, 유지비용 좋게 bmw 차량을 타고 싶다면 추천 초기비용 감안해도 오래 타실 분들에게 좋음 단 m팩 안들어가면 휠디자인 못생겨지는 단점이 있고 주행 감각이 스포티하다기보다는 컴포트한 편이므로 처음 bmw 입문하시는분들은 상관없지만 다른 bmw 타시다가 넘어오면 이질감이 들 수도 있음"
2026 BMW iX1,8.67,베이비 X5 디자인 우락부락 매우만족스럽고 넉넉한 사륜 듀얼모터 출력 또한 엑셀깊게 밟으면 허리가 저릿할정도...! 다만 실주행거리가 390정도는 나오긴하지만 아쉬운건 사실 통풍시트 없는것도 아쉽 그래도 내차 최고
2026 BMW iX1,8.83,안드로이드오토가 자주끊겨요 디자인너무맘에들고 요크그린색 너무이뻐요 기능이너무많아서 공부를 많이해야되요 성능좋습니다
2026 BMW iX1,7.33,차는 마음에들고 주행거리도 좋지만 결함이 너무 많아요.3/30일에 인도 받았는데 다음날 네비 오류뜨고 현재까지 구동장치결함.네비.계기판오류로 계기판교체.문열림경고등점등. 반자율주행도 자동으로 켜지고있어 한달째 센터에 있네요..뽑기실패했어요 뽑기만 잘 하신다면 추천입니다. 출력은 좋아요!뒷자석은 승차감은 좋지는 않아요! 방지턱 넘을때 점프하는 느낌..
2026 BMW iX1,9.33,"3인 가족용 만족. 주행질감 및 성능은 대만족. 상대적으로 옵션이 많아, 약간 높은 가격은 이해됨."
2026 BMW iX1,9.50,엔트리급...그러나 실내 공간도 넓어 4인 가족 패밀리 카로도 충분해요. 대단히 만족스럽습니다.
2026 BMW iX1,8.83,집에서 멀지 않은 곳을 마음껏 다니면서 디자인도 좋고 출력도 좋아서 만족하고 다니고 있습니다 충전도 인프라만 잘되어 있다면 불편하지 않았습니다 저는 전체적으로 만족 합니다
2026 BMW iX1,8.83,"너무좋아요. 생각보다 넓어요. 실주행은 400정도 나오는거같습니다. 옵션이 좋아요,"
2026 BMW i7,10.00,모든 부분들 아주 만족 스럽네요. 내연기관 차량으로 못 넘어갈거 같아요
2026 BMW i7,9.33,가솔린 디젤 플랫폼을 공유하다보니 실내 콘솔이나 트렁크공간이 좁긴하지만 승차감이 정숙성 하차감 머하나 빠지는거 없이 최고입니다. 차가 길어서 주차가 조금 어렵기도해요 익숙해지면 괜찮아질듯. 아무튼 최고의 차임에는 분명합니다^^
2026 BMW i7,10.00,"전반적으로 퀄리티가 높습니다. S580에서 넘어왔는데, 적응 기간 좀 지나고 나니 상당히 만족스럽습니다."
2026 BMW i7,9.67,울트라비니군 영상보고 가솔린 엔진을 사려다 전기차를 구매했습니다 후륜이어서 망설여진게 사실이지만 전기차는 무거워 눈길에 크게 미끌거리지 않겠다는 판단이 들어 구매했고 경험해보지 못한 드라이빙이었습니다 매운 만족합니다
2026 BMW i7,10.00,주행성능 - 2.5톤이라는 무게가 무색 할 정도로 미끄러지듯 너무 잘 나가고 운전이 편안합니다. 코너도 너무 안정적이고 프론트 리어 모두 에어서스펜션인데 너무 딱딱하지 않아서 승차감도 좋습니다. 브레이크는 전자식이라서 그런지 모르겠지만 끝부분에서 살짝 답력이 없어지면서 충격없이 정차하는게 어렵지만 이건 뭐 적응되니 컨트롤 가능합니다. 10점 가격 - 많이 비싼편이지만 이번 7시리즈부터는 롤스로이스 프레임의 차대를 이 가격에 구매 할 수 있다는 사실만해도 개이득이 아닌가 싶습니다. 10점 거주성 - 시트가 생각보다 많이 부드럽습니다. 부드럽지만 단단해서 처음 앉으면 편안함이 느껴지고 오래 않아있어도 피로가 잘 쌓이지 않는느낌입니다. 실제로 예전엔 장거리 운전하면 엉덩이가 아파서 휴게소에 들리곤했는데 이젠 충전해야해서 들리네요. 뒷자리가 더 좋다는데.. 뒷자리는 못앉아볼듯... ㅠㅠ 10점 품질 - 10점 디자인 - 호불호갈리는 디자인이라.. 저는 100점 체감연비 - 10점
2026 BMW i7,10.00,차량 디자인 만족 성능 만족 주행 가능거리 만족 가격 만족 차량 압도적인 크기 만족 세컨으로 타기에 좋네요
2026 BMW i7,10.00,첫 전기차여서 약간의 걱정과 우려가 있었는데 막사 받고 운행해보니 매우 힘이 좋고 부드럽고 편안합니다. 아주 만족중임!
2026 BMW i7,10.00,젊어진 디자인과 고속에서의 안전성이 최고인 차량…보유하고 있는 다른 차량은 강제 냉동중
2026 BMW i7,9.67,품질도 좋고 주행 감각도 뛰어납니다. 내연기관 차만 타다가 처음 타는거라 살짝 걱정도 했는데 기우였네요. 공인연비를 무시하는 주행거리를 보여줍니다. 현재 전비는 5.2 정도 나오네요. 하루 80킬로 정도 출퇴근에 주행하는데 충전도 1주일에 한번 정도만 해도 되니 편리합니다. 이전에 타던 760이 별로 생각이 안나네요
2026 BMW i7,9.33,승차감은 580보다 좋고 쓰인 소재도 고급스럽고 전체적으로 만족스럽습니다.
2026 BMW i7,10.00,현재 전기차의 끝판왕 디자인도 훌륭하고 성능도 좋음
2026 BMW i7,9.83,"한줄평: 브랜드 대비 가격만 빼면 모든것이 만족스러운 차량. 최고강점: (벤츠S 대비)시트포지션 - 그래서 승,하차시 아주 적절한 높이로 몸을 받아줌. - 그 어중간한 시트포지션이 의외로 매우 만족하는 포인트다."
2026 BMW i5 M60,9.33,전기차 선택하는것을 많이 망설였었는데 정말 대만족입니다. 오래타고 싶어요.
2026 BMW i5 M60,10.00,"주행성능, 안전편의사항 뭐하나 빠지는게 없네요 출력도 이만하면 충분하고 전비도 잘 나오고 승차감 좋아요!!"
2026 BMW i5 M60,10.00,날 좋은날 애태우고 천천히 안답답하게 타면 600키로 탑니다ㅋㄲㅋㅋㅋ 최고입니다
2026 BMW i5 M60,9.50,"저에겐 전기차 승용중 최고입니다. 먼저 비엠더블유 브랜드 가치와 함께 차량 성능과 디자인 모두 마음에 들고 원격지원, 실내디자인, 모니터 반응속도와 반자율주행 등 모든면에서 마음에 들어요"
2026 BMW i5 M60,9.67,i7 다음으로 세단중에서는 최고의 전기차 승차감. 출력. 정숙성 모두 만족
2026 BMW i5 M60,9.50,"할인 받으면 비용 대비 성능,품질,안정성은 이보다 괜찮은 대안이 있을까 싶고요. 전장이슈가 좀 있다던데 저는 아직 딱히 없었습니다. 2열 좌석 헤드레스트가 쪼끔 꺾여있어서 적응이 필요합니다(저는 반대로 뒤집어놨어요). 일상 주행에서는 모든 면에서 차고 넘칩니다..ㅎ"
2026 BMW i5 M60,9.17,할인이 좋을때 구매하면 전기차중 거의 탑 급 테슬라 갈라했는데 불편한 모니터와 i5에 비하면 턱없이 부족한 승차감 / 코나 디자인이 넘 짜침 다만 주행거리가 좀 아쉽다...100kw 배터리면 얼마나 좋을고
2026 BMW i5 M60,8.50,"승차감은 너무 좋습니다. 다만, 뒷자리가 조금 더 편안해지고~ 각종 편의사항이 더더더더 추가되어야 한다고 생각합니다~, 주행거리는 풀충전 하면 540km까지 나오지만 전비는 그냥 평균 수준인듯 합니다~"
2026 BMW i5 M60,9.33,전체적으로 잘만든 자동차입니다 가격이 조금쎄긴하지만 너무만족스럽게 잘타고있어요
2026 BMW i5 M60,8.83,5시리즈에 이돈을 태워? 하시는 분도 계시겠으나 한번 타보면 급 수긍을 하게 됩니다. 리틀 7시리즈라고해도 과장이 아님을 알수 있고요. 가속력이나 파워도 이정도면 사실 실생활 주행에서는 과할 정도입니다.
2026 BMW i5 M60,9.50,"실내외 디자인, 마감, 고급감 좋습니다. 특히 주행성능 및 승차감 아주 좋습니다. 다만 국산 세단 대비 실내 공간이 아쉽습니다. 긴 주행가능거리 고속안정성, 오토파일럿에 준하는 반자율주행 모두 만족스럽습니다!"
2026 BMW i5 M60,5.33,전반적으로 걍그럼 내가 대체 멀쩡한 테슬라를 버리고 이걸 왜 샀을까 자괴감이 심하게 듬 반자율은 비엠이 2등이라는데 1등과 2등 격차가 너무 심함 테슬라 사세요
2026 BMW i5 M60,9.67,"전기차다보니 중속에서 확실이 무거운 감은 있지만, 공도에서 가속은 충분하다고 느껴집니다. 출시 초기에는 디자인이 좀 과한것 아닌가 생각했었는데, 타다보니 괜찮다 싶네요..차량 가격이 높아서 보조금은 못받지만, 프로모션을 받아보니 나름 위안이 되기도 합니다. 결정적으로 100%충전 시 주행가능거리가 570km까지도 나오긴 합니다.(다만, 전기차 특성상 주행가능거리가 큰 폭으로 늘었다 줄었다하긴 해요..;;그래도 보통 480km까지는 타는것 같아요) 전기차의 불편한 특징 중 하나인 울컥거림도 좀 덜한 느낌이고요.. 약 1달 간 주행해본 결과 만족하고 있습니다. 그 중 지금까지 가장 뿌듯한건 차지비 및 차지비 로밍 충전소에서 사용 가능한 1년 무제한 충전권인것 같아요..하루 주행거리가 보통 80~90km인데 집밥이 차지비라 출고 후 2천키로 넘게 탔는데 충전비용이 총 7백원 정도 들었어요.(나머지는 무제한 충전 크래딧 사용)"
2026 BMW i5 M60,9.50,"전기차 특유의 미끄러지는 주행 느낌은 20km 정도나 110km 정도나 다 비슷하게 편안합니다. 이 느낌은 폴스타4, 제네시스 전동차에서도 비슷하게 시승하면서 느꼈는데, bmw는 잘 흘러가는데도 묵직한 느낌을 줍니다. 2열은 걱정했던 것보다 거주성이 괜찮습니다. 탈 때는 좁아보이는데 막상 앉으면 편안하다네요. 운전석에 앉은 주행감은 보들보들하면서도 딴딴한, 이 느낌은 앉아서 실제 운전해 봐야 알 수 있어서 시승해보시는 것을 권유드립니다."
2026 BMW i5 M60,10.00,운행거리가 많고 성능과 품질을 고려할 때 경제적 측면에서도 매우 만족함
2026 BMW i5 M60,9.33,전반적으로 만족스럽네요 조금더 전기차 주행거리가 늘어났으면 좋겟습니다.
2026 BMW i5 M60,8.33,"좋습니다. 다만, 자리 쿠션만 좋아졌으면 좋겠습니다. 다른건 만족합니다."
2026 BMW i5 M60,9.17,530i x드라이브 사려다가 할인받으니 가격대가 같아서 전기차 한번 타보자해서 구해했는데 정말 대 만족!!!!! 디자인 승차감 공간 어느하나 부족한게없음!!
2026 BMW i5 M60,9.67,전기차 생각보다 불편하지않고 350킬로 이상 장거리 여행도 할만하네요 단지 어디 가기전에 충전기 위치확인하는 버릇을 들여야됩니다
2026 BMW i5 M60,10.00,깔게없는차! 봄가을에 에피션트모드면 600km를 넘는 주행거리와 1년무료충전도 소소한 대박^^ 가격은 사악하지만 큰거두장에 가까운 프로모션으로 현실적 가격은 합리적!
2026 BMW i5 M60,8.50,몇몇 아쉬운 옵션 빼곤 할인과 가격대비 괜찮은 유지비용으로 인해 전반적으로 만족
2026 BMW i5 M60,9.67,"뒷좌석은 키 160정도까지는 극락이나 175정도부턴 약간 불편한 감이 있을 수 있습니다. 시트등받이가 각도조절이 안되고 앉아보면 약간 꼿꼿한 자세가 될 수 있기 때문입니다. 가격은 프로모션받으면 적당히 잘 살 수 있고, 전기차라 그런지 토크의 시원시원함은 공도에서 부족할 게 전혀 없습니다. 한스짐머 사운드는 명작입니다."
2026 BMW i5 M60,8.67,차 무게와 크기를 고려해도 원하는데로 움직여 주는게 역시 bmw라는 생각이 드네요 :) 하지만 소프트웨어 잔오류들이랑 회생제동 최대에서 돌아올때 브레이크에서 느껴지는 튕기는 느낌은 좀….
2026 BMW i5 M60,8.67,"종합의견은 대만족 9천만원중반인데 할인받으면 7천 초중반정도 게다가 1년 무료충전권도 줘서 개꿀 소재부분이 너무 아쉽지만 정숙성,주행성능은 최고 아직 도로에서 흔하지 않은 것 같아서 굿굿 다만, 요즘 전기차 보는 시선+그돈씨 듣기 좋음"
2026 BMW i5 M60,7.67,빠르고 민첩하지만 무거운데다 차가 커 운전 재미는 별로 없습니다. 내장에서 버튼류나 손잡이가 플라스틱이라 아쉽네요. 공간은 이전 세대보다 크지만 뒷자리 좌석 구조가 독특해 호불호가 갈릴 수 있습니다. 주행거리는 성능 감안하면 괜찮습니다.
2026 BMW i5 M60,9.33,전체적으로 만족입니다. 아쉬운점은 G30 530i 대비하여 소프트클로징 없구.. 도어 씰? 스텝? 트림? 그게 아예 없구.. 트렁크 조금 더 좁아진건 어쩔 수 없는거 같구... 이 정도? 차량 성능은 대만족입니다.
2026 BMW i5 M60,10.00,너무 만족하며 타고 있습니다. 운전하며 감탄사의 연속!!역시 bmw !!
2026 BMW i5 M60,9.67,"안타본 사람들만 걱정하는 차. 전반적으로 너무 만족스럽고, 승차감 주행능력 등등 다 확실히 좋음"
2026 BMW i5 M60,9.17,정숙하며 편안한 차입니다. 실내 공간도 넓어서 가족 태우기에도 부족함이 없는것 같습니다. 가격만 8천만원대였으면 많이 팔릴 차입니다
2026 BMW i5 M60,9.17,성능에 만족하며 운행하는데 이질감이 없어 좋아요 전기차중 가장 안정적이며 럭셔리한 전기차 입니다
2026 BMW i5 M60,9.67,5시리즈와 동일한디자인. 벤츠처럼 전기차라고 못생겨지지않아서 좋음. 가속성능. 배터리 .주행가능거리. 충전속도. 전비 모두 최상위클래스. 가격빼고 모두 착함.
2026 BMW i5 M60,9.67,첫독일차 첫전기차 i4보다가 i5로 결정 부드러운 주행감 마치 비행기타고 날아가는기분입니다 소렌토도 승차감이 좋았는데 그보다 월등하네요 다음차도 전기차로
2026 BMW i5 M60,9.67,"전기차는 처음 샀습니다만 정말 잘만든 차라는 느낌이 듭니다. 주행성능, 주행질감, 내부, 외부 다 좋습니가. 단지 흠을 꼽자면 차체가 넘 길어요."
2026 BMW i5 M60,9.00,가격이 다소 사악하지만 그만큼 만족감을 주는 차라고 생각합니다. 디자인 주행성능 편의성 어느하나 빠지지 않고 우수해서 직접 타보면 그 가치를 느낄수 있는 차 입니다.
2026 BMW i5 M60,9.67,전기차이나 전기차같지않은 너무 만족스러운 차입니다. 전기 충전이 조금 번거롭지만 모든 전기차들이 그렇잖아요
2026 BMW i5 M60,9.33,"조용하고 승차감 좋음. 전기차지만 디자인 및 운전 편의성 매우 좋음. EQS 대비 유사한 성능, 운전 편의기능보유 & 우수한 디자인 보유. 타이칸 대비 디자인은 좀 딸리지만 우수한 가성비. 유사한 사양의 타이칸 대비 7~8천 정도의 이점 보유(물론 포르쉐와 BMW라는 차이는 감안해애지요ㅋ.) 전체적으로 우수한 만족감으로 두달째 운행 중ㅎㅎㅎ 추천할 수 있는 차량"
2026 BMW i5 M60,10.00,이전 세대 g30 lci 가 디자인이나 마감은 마음에 들었으나 차는 역시 그래도 신형이 좋네요!
2026 BMW i5 M60,9.67,최고의 럭셔리 전기차를 원한다면 대안이 없을 것으로 생각됨 독일 프리미엄세단을 원한다면 후회없는 선택이 될 것
2026 BMW i5,9.33,전기차 선택하는것을 많이 망설였었는데 정말 대만족입니다. 오래타고 싶어요.
2026 BMW i5,10.00,"주행성능, 안전편의사항 뭐하나 빠지는게 없네요 출력도 이만하면 충분하고 전비도 잘 나오고 승차감 좋아요!!"
2026 BMW i5,10.00,날 좋은날 애태우고 천천히 안답답하게 타면 600키로 탑니다ㅋㄲㅋㅋㅋ 최고입니다
2026 BMW i5,9.50,"저에겐 전기차 승용중 최고입니다. 먼저 비엠더블유 브랜드 가치와 함께 차량 성능과 디자인 모두 마음에 들고 원격지원, 실내디자인, 모니터 반응속도와 반자율주행 등 모든면에서 마음에 들어요"
2026 BMW i5,9.67,i7 다음으로 세단중에서는 최고의 전기차 승차감. 출력. 정숙성 모두 만족
2026 BMW i5,9.50,"할인 받으면 비용 대비 성능,품질,안정성은 이보다 괜찮은 대안이 있을까 싶고요. 전장이슈가 좀 있다던데 저는 아직 딱히 없었습니다. 2열 좌석 헤드레스트가 쪼끔 꺾여있어서 적응이 필요합니다(저는 반대로 뒤집어놨어요). 일상 주행에서는 모든 면에서 차고 넘칩니다..ㅎ"
2026 BMW i5,9.17,할인이 좋을때 구매하면 전기차중 거의 탑 급 테슬라 갈라했는데 불편한 모니터와 i5에 비하면 턱없이 부족한 승차감 / 코나 디자인이 넘 짜침 다만 주행거리가 좀 아쉽다...100kw 배터리면 얼마나 좋을고
2026 BMW i5,8.50,"승차감은 너무 좋습니다. 다만, 뒷자리가 조금 더 편안해지고~ 각종 편의사항이 더더더더 추가되어야 한다고 생각합니다~, 주행거리는 풀충전 하면 540km까지 나오지만 전비는 그냥 평균 수준인듯 합니다~"
2026 BMW i5,9.33,전체적으로 잘만든 자동차입니다 가격이 조금쎄긴하지만 너무만족스럽게 잘타고있어요
