car,score,content
2026 포르쉐 카이엔 GTS,8.17,"마데인 독일이 아니라 그전 모델보다 완성도가 조금 미숙한듯, 하지만 디자인은 너무이쁨 차는 좋으나 포쉬 코리아와 서비스센터는 쒸레기수준"
2026 포르쉐 카이엔 GTS,9.17,가격이 비싼것 빼고는 전체적으로 만족스러워요.디자인 성능 실내 모두 좋아요.
2026 포르쉐 카이엔 GTS,7.50,일단 실내가 넓어서 좋음.외관도 웅장하니 멋지나 주차가 좀 까탈.폼으로 타고 다님.
2026 포르쉐 카이엔 GTS,4.67,만족스러운 디자인 품질 승차감입니다. 연비와 가성비는 좀 아쉬운거같습니다
2026 포르쉐 카이엔 GTS,9.67,"Suv를 사고싶고 스포티한 주행성능을 갖고싶고, 차량에서 어느정도의 카리스마?를 느끼고싶다면 이것보다 나은 선택지가 없을것 같아요"
2026 포르쉐 카이엔 GTS,7.33,하이브리드라 전기완충하면 연비는 좋습니다 승차감 좋구요 디자인맘에듭니다 근데 가격이 너무비싼게 단점입니다
2026 포르쉐 카이엔 GTS,9.67,하브...이건 승차감 연비 출력 모두 다 잡은 최고의 차라는게 확실하다. 무조건 충전가능한 인프라가 갖춰져 있을 경우 안살 이유는 없다.
2026 포르쉐 카이엔 GTS,9.17,"브랜드 네임, 실용성, 주행성능 등 모든 needs를 만족시키는 가족용 럭셔리 SUV의 현재 답안지"
2026 포르쉐 카이엔 GTS,6.17,가격대비 성능은 만족하지 못함 차의 내구성은 좋은 편이나 디자인은 만족스럽지 못함
2026 포르쉐 카이엔 GTS,9.83,카이엔 하이브리드 모든 면에서 최고입니다! 어떤 측면으로는 가성비도 좋은차
2026 포르쉐 카이엔 GTS,8.50,성능 디자인 모두 만족요 아주 괜찮습니다 품질은 쫌 생각보단 보통이입니다
2026 포르쉐 카이엔 GTS,8.50,"Suv를 사고싶고 스포티한 주행성능을 갖고싶고, 차량에서 어느정도의 카리스마?를 느끼고싶다면 이것보다 나은 선택지가 없을것 같아요"
2026 포르쉐 카이엔 GTS,8.33,"차가 아주 안정적입니다. 첫 수입차라 다른것들은 어떤지 잘몰라서 비교는 힘들지만... 잠깐씩 타본 수입차(X7, 730d, CLA) 등에 비해 하체가 단단해서 안정적인 느낌은 확실히 듭니다."
2026 포르쉐 카이엔 GTS,8.83,가족들과 함께타기에 좋고 주행성능이나 디자인도 훌륭해서 개인적인 만족도도 높은차량입니다.
2026 포르쉐 카이엔 GTS,8.00,최고에 아빠 차량 달리고 싶을때 스포츠카 가족들과 편한히 가고 싶을때 그냥 편한 suv 품위 편안함 가속력 다 가짐 하지만 가속력 있는만큼 역시 연비는 별로
2026 포르쉐 카이엔 GTS,8.50,전반적으로 만족하며 특히 디자인이 이쁜 차량입니다. 다만 트렁크가 생각보다는 좁네요.
2026 포르쉐 카이엔 GTS,7.83,가격대비 브랜드나 차량성능은 만족스러워요 연비가 사악합니다. 배기가 팝콘이 없어 심심합니다.
2026 포르쉐 카이엔 GTS,8.50,가성비 생각만 안하면 나무랄게 없네요. 디자인은 호불호가 있을수있으나 전 타다보니 다른 SUV보다 날렵한게 좋네요
2026 포르쉐 카이엔 GTS,9.50,뒷죄석 거주성도 좋고 운전성능도 의외로 편합니다. 차량이 무거우니 연비는 어쩔 수 없죠. 자동차의 기본기로 보자면 이 급에서는 여러모로 가장 만족스러운 차종이라 생각합니다.
2026 포르쉐 카이엔 GTS,9.17,포르쉐 성능 + 연비 두마리 토끼를 잡은 차. You can feel the feelings of being given look by other peoples easily.
2026 포르쉐 카이엔 GTS,8.83,만족도 좋아요 출고 기다리는데 대기시간이 길었지만 기다린만큼 만족합니다
2026 포르쉐 카이엔 GTS,8.33,탈만 함. 승차감 좋음. 연비는 그닥. 할 말 다했는데 확인 버튼이 안뜨네? 이제 뜬다
2026 포르쉐 카이엔 GTS,8.50,"역시 명불허전 포르쉐입니다.외관으로부터 내부 디자인까지,편안함,럭셔리함은 최고입니가."
2026 포르쉐 카이엔 GTS,9.67,SUV도 포르쉐가 만들면 다르구나라는 걸 알 수 있는 차입니다. 완벽한 family car입니다.
2026 포르쉐 카이엔 GTS,8.00,독삼사 이상의 급을 원한다면 패밀리카로 쓰기에 현실적으로 최고의 선택으로 보임
2026 포르쉐 카이엔 GTS,8.50,"포르쉐다운 주행성능, 연비는 생각하지 마시길.. 단 하브는 꽤 괜찮음.. 잡소리는..."
2026 포르쉐 카이엔 GTS,9.83,가까운 근거리나 시내주행일 경우 배터리로 다니기 때문에 연비는 말할 필요없이 너무 좋고 중장거리는 하브오토로 다녀 15km이상 연비 나오네요. 연비로 산건 아니지만 조용하게 다닐땐 한없이 조용하고 다이나믹하게 주행할땐 배터리가 힘을 보태주니 2가지 차를 다 가진 느낌입니다. 가격대가 비싸다 생각할 수 있지만 중고가 방어를 봤을땐 후회없는 선택일것 같네요
2026 포르쉐 카이엔 GTS,9.00,탈수록 멋지고 만족하는 차량. 쿠페라서 더 예쁘다. 출고기간이 오래 걸리는 것을 제외하면 내구성 우수하고 품질좋고 주행감 좋은 최고의 suv.
2026 포르쉐 카이엔 GTS,9.33,흠잡을데 없는 좋은차이지만.. 독일차에 특성인 핸들조작에쪽에 소음이 조금있네요 벤츠도 거의 그런것같아요
2026 포르쉐 카이엔 GTS,9.17,기본만있는차에 옵션가격 계속붙어서 실구매가격이 높네요 그것빼고는 대체로 모든면이 만족합니다
2026 포르쉐 카이엔 GTS,9.33,패밀리카로 최고예요. 디자인은 너무 예쁘고 승차감은 편안하고 연비는 생각보다 좋아요.
2026 포르쉐 카이엔 GTS,9.33,흔한거 같으면서 흔하지 않은 차량으로서 전반적으로 괜찮은 차량이다 좋은차량인거 같다
2026 포르쉐 카이엔 GTS,8.50,우르스는 비싸고 독3사는 흔하게 느껴질때 딱인 차입니다. 뽑기운이 작용하고 운좋을 확률은 70프로 정도? 망할 포르쉐코리아의 서비스정책과 야금야금올리는 가격만 아니면 괜찮은 차
2026 포르쉐 카이엔 GTS,8.67,만족스럽다`~~~~~~~~~~~~~~~~~~~~~~~~
2026 포르쉐 카이엔 GTS,9.00,마크가 말해주고 마크가 평가받는차 긴말필요 없음 하차감 완승 ! 엠블럼하나로 만족하고 타는차
2026 포르쉐 카이엔 GTS,8.17,SUV의 활용성과 스포츠 주행 성능을 겸비한 차 중엔 최고라 생각한다. 스포티함과 벤츠의 럭셔리함을 모두 겸비한 차
2026 포르쉐 카이엔 GTS,8.83,카쿱 1.1억 시작가이지만 필요한 옵션 넣으면 1.5억정도 취등록세 보험까지해서 1.6정도는 생각해야합니다. 연비는 의미없는거같고 전체적으로 만족스럽습니다.
2026 포르쉐 카이엔 GTS,7.50,가성비가 좋아요 벤츠300d가실구매가 보다 4천만원만 더주면 포르쉐 suv를 소유할수있어요
2026 포르쉐 카이엔 E-하이브리드 쿠페,10.00,여러가지 suv를 소유해 봤지만 모든면에서 최고입니다. 역시 포르쉐가 만들면 달라요.
2026 포르쉐 카이엔 E-하이브리드 쿠페,9.00,"40대 여성 SUV는 처음, 그게 포르쉐 카이엔 좋음 시야확보 좋고, 차뽑기가 잘되서 잔고장 없이 좋음 생각보다 차가 커서 주차는 어렵지만, 원래 주차에 약한 편"
2026 포르쉐 카이엔 E-하이브리드 쿠페,9.33,포르쉐 입문용으로 타기 좋고 때론 패밀리카로 때론 스포츠카 처럼 타기 좋으며 감가가 적어요
2026 포르쉐 카이엔 E-하이브리드 쿠페,8.50,"연비가 생각보다는 괜찮았음. 가득주유하면 시내+고속 포함해서 평균 700키로이상은 주행함. 승차감, 디자인은 말할것도 없고 편의기능은 가격대비 생각하면 부족함."
2026 포르쉐 카이엔 E-하이브리드 쿠페,10.00,전체적으로 매우 만족합니다. 가격이 많이 오르긴했지만 이정도 품질이면 합당한 가격이라 생각됩니다. 하브가 경고등 이슈가 있는거 같던데 제차량은 괜찮네요.
2026 포르쉐 카이엔 E-하이브리드 쿠페,6.33,"반응 좋고 잘나가고 차량 가격 생각하면 당연한 성능을 충분히 보여주는 차량, 디자인과 포르쉐 감성을 충분히 느낄수 있으나 엔진오일 등 각종 소모품 교체 및 유지 비용이 비정상적으로 높으며 이에 상응하는 서비스 센터의 서비스 수준은 분노할 만큼 엉망임. 차량 소프트웨어 및 각종 센서류가 비정상 및 오류가 많으며 해당 문제들에 대해 제조사도 정확히 해결 방법을 모르고 있음. 종합적으로 포르쉐 감성 하나로 타기엔 충분하나 품위 유지비를 상당히 감수해야함"
2026 포르쉐 카이엔 E-하이브리드 쿠페,8.50,"비쌈, 특별한 특징 없음, 포르쉐 이름 값빼면 BMW가 훨 좋은 차임. 차알못 유투버 리뷰하는 사람들 말듣고 샀다가 후회함. 걍 BMW 살걸 ㅜ"
2026 포르쉐 카이엔 E-하이브리드 쿠페,9.50,가격빼고 모두 괜찮음. 하브라서 복합연비 양호. 디자인 세련. 승차감 좋음.
2026 포르쉐 카이엔 E-하이브리드 쿠페,7.50,생각보단 빠르지않고 승차감은 좋은편같네요 아아아가가가사사사하하하자자자카카카
2026 포르쉐 카이엔 E-하이브리드 쿠페,8.33,고성능 suv 패밀리카입니다. 저는 매우 만족합니다. 연비는 시내주행에서 4~5정도이고 고속에서는 9정도 나오네요.
2026 포르쉐 카이엔 E-하이브리드 쿠페,10.00,정말좋은차량입니다. 다른어떤차종도 비교불가입니다. 연비우수 주행성능우수 하차감 우수
2026 포르쉐 카이엔 E-하이브리드 쿠페,6.33,포르쉐포르쉐포르쉐포르쉐포르쉐포르쉐포르쉐 포르쉐포르쉐포르쉐포르쉐포르쉐포르쉐 이상.
2026 포르쉐 카이엔 E-하이브리드 쿠페,9.00,"매력적이고, 아주 좋습니다~~ 다만 연비 안좋고, 너무 비싼거 빼곤요~~^^"
2026 포르쉐 카이엔 E-하이브리드 쿠페,7.50,굿 타봐야지 안다 왜 명차가 명차인지는 타보기전엔 깔생각을 하지도말아라^^
2026 포르쉐 카이엔 E-하이브리드 쿠페,8.83,SUV 불구하고 승용 투도어 스포츠카 주행느낌. 가볍고 민첩하고 피제로 코르사 떡그립 타이어와 PDCC 조합의 코너링. 운전 좋아하는분들만 타셔요
2026 포르쉐 카이엔 E-하이브리드 쿠페,9.83,"주행성능과 배기음 모두 99% 만족, 1% 아쉬움. PHEV 특유의 전기 운행 가능 주행거리도 약간 아쉽지만 전반적으로는 가격 외에는 만족도 최상"
2026 포르쉐 카이엔 E-하이브리드 쿠페,9.67,차의 디자인과 성능은 정말 최고 입니다 서스펜션 모드별로 주행 질감도 더할나위 없이 좋습니다 디스플레이도 디지털화 되어 최신 감성이 물신 나며 버튼들도 최신 감성을 더해 줍니다 다만 조금 세계 타다 보니 전륜 조향이 멀티링크의 특성인지 모르겠으나 조금 헐거운 듯한 느낌도 나네요 더블위시본이었다면 조금 더 좋은 감성을 냈을 것이라고 생각해 봅니다
2026 포르쉐 카이엔 E-하이브리드 쿠페,8.33,디자인은 정말 이뻐요 연비는 당연이 최악이지만 배기음과 출력이 정말 마음에 듭니다
2026 포르쉐 카이엔 E-하이브리드 쿠페,8.67,"주행성능과 품질, 디자인 면에서 압승이다. 단점은 서비스센터 대기시간이나 가격이 사악함."
2026 포르쉐 카이엔 E-하이브리드 쿠페,8.67,차문 열고 자리에 앉아 시동걸고 엔진 안정화 2분 기다리고 엑셀밟고 나가는 순간..다 좋습니다.
2026 포르쉐 카이엔 E-하이브리드 쿠페,10.00,"하이브리드 쿠페 모델을 소유하고 있으며 충전을 주 2회정도 해 줘야 하는 점은 있지만 완충 비용이 5500원 정도로 90km을 이동할 수 있는 점과, PHEV로 국산 하이브리드차량들이 모터자체 구동을 못하는 것과 달리 모터만으로도 충분히 단독 주행이 가능하며, PASM, PDCC 적용으로 극강의 승차감을 보여주는 차량입니다. 스포츠 배기 탑재로 드라이빙의 또하나의 즐거움을 선사합니다. 가솔린 버전은 솔직히 소음, 진동, 연료비(물론 연료비 생각하고 타는 차는 아니지만) 등에 있어서 하이브리드에 현격히 떨어지는 모습입니다. 가능하시면 하이브리드를 구매하시기를 강추드립니다. 하이브리드로도 가솔린 모드로 달릴 수 있으니까요."
2026 포르쉐 카이엔 E-하이브리드 쿠페,10.00,나만의 포르쉐 ㅋㅋㅋ나만의 포르쉐 ㅋㅋㅋ나만의 포르쉐 ㅋㅋㅋ나만의 포르쉐 ㅋㅋㅋ
2026 포르쉐 카이엔 E-하이브리드 쿠페,7.50,"인포테인먼트의 불편함/ 생각보다 별로인 에어서스펜션 / 2억에 가까운 차 안에서 들리는 잡소리 등 디테일을 제외하고 본질적인 차량의 성능과 운동능력은 최고. 하이브리드라 전기로 이용하지 않았다면 연비는 잘 나오면 7~8km/l / 장거리 운행 시, 시트가 딱딱한 편인데도 지나고나면 벤츠이클이나 G80보다 피로도가 훨씬 덜 함."
2026 포르쉐 카이엔 E-하이브리드 쿠페,9.50,굿입니다ㅎㅎ특히 플러그인하이브리드라 연비가 죽이네요 다른 분들에게도 강추합니다!!
2026 포르쉐 카이엔 E-하이브리드 쿠페,9.33,드라이빙 기술및 디자인 모든면에서 만족하며 하이브리드모델로 출력또한 뛰어나다.
2026 포르쉐 카이엔 E-하이브리드 쿠페,6.67,포르쉐는 이렇게 타는거구나 생각되네요. 하하하하하하하 하하하하하하하 하하하하하하하
2026 포르쉐 카이엔 E-하이브리드 쿠페,7.67,"포르쉐 방패마크를 제외하고는 딱히 메리트는 없는거 같음 연비가 좋지도 않고, SUV에게 스포츠성을 기대할 수는 없고, PCM 고장은 루틴이라 많이 귀찮음. 근데 AS센터 예약조차 쉽지 않음."
2026 포르쉐 카이엔 E-하이브리드 쿠페,7.00,"가성비는 상당히 떨어지나, 디자인, 성능 등 너무 좋습니다. 상당히 만족합니다."
2026 포르쉐 카이엔 E-하이브리드 쿠페,9.00,구매예정이라면 카이엔은 무조건 플러그인 하이브리드로 구입하세요 유지비가 적게 들어요
2026 포르쉐 카이엔 E-하이브리드 쿠페,7.67,성능 좋고 승차감 좋고 디자인 이쁘고 하지만 연비 최악… 가격 비싸지요~~^^;;
2026 포르쉐 카이엔 E-하이브리드 쿠페,9.83,카이엔쿠페 하이브리드 플레티늄 에디션에 PDCC 넣고 풀옵 출고했는데 그 둥둥 거리는 느낌이 너무 좋음 전기로만 시내 주행 편하게 가능하고 여러모로 만족도가 높음
2026 포르쉐 카이엔 E-하이브리드 쿠페,8.50,"V6 3,000cc정도급으론 이만한차 없습니다. 잘달리고 잘멈추고 생각보다 많이 안먹고 이제껏 타면서 고장한번 않나고. 다만 레인지로버같은 편안함을 추구하시는분께는 비추지만 그렇지않은분께는 추천할만 합니다."
2026 포르쉐 카이엔 E-하이브리드 쿠페,8.67,전반적으로 만족도가 높은 차량 주행성능 및 연비가 좋음 잔고장도 없이 잘 타는 중
2026 포르쉐 카이엔 E-하이브리드 쿠페,6.17,카이엔 2번째 구매자 입니다. 성능 대비 가격은 사악하나 그래도 뭐 나는 사실 달리려고 타는 차는 아니라서 방패값이라고 생각하고 탑니다. 반대로 생각하면 방패값치곤 비싸지 않게 느껴져요
2026 포르쉐 카이엔 E-하이브리드 쿠페,8.83,"브랜드, 하차감, 디자인 좋으나 편의사양은 다소 미흡함. 그러나 대체로 만족합니다."
2026 포르쉐 카이엔 E-하이브리드 쿠페,9.83,"차 한대로 패밀리카+스포츠카, 내연기관+전기차 를 한번에 누릴 수 있는 차. 옵션포함 거의 2억 언저리인 가격이 약간 아쉽지만, 이 가격대에서 대안도 없는 포지션 PDCC는 SUV임을 완벽히 잊게하는 말도안되는 롤 억제력을 갖은 최고의 옵션. 페이스리프트되면서 순수전기 주행거리가 80~90까지 나오니까 출퇴근은 기름쓸일이 없음 다시 선택해도 카이엔 쿠페 하이브리드"
2026 포르쉐 카이엔 E-하이브리드 쿠페,9.00,하이브리드 차량 너무 만족스럽습니다. 다시 사도 카이엔 하이브리드!!!
2026 포르쉐 카이엔 E-하이브리드 쿠페,6.83,디자인과 브랜드 빼면 좋은거 찾기힘드네요.국산차가 품질은 훨씬좋은것 같습니다.하지만 탈 때마다 기분은 좋네요 ㅋ ㅋ 그냥 내 만족에 타는차 인듯
2026 포르쉐 카이엔 E-하이브리드 쿠페,9.83,연비는 쏘쏘. 그러나 실내 거주성과 출력 배기음이면 이미 대체불가입니다.
2026 포르쉐 카이엔 E-하이브리드 쿠페,8.33,드라이빙 능력 만듦새 완성도 모두좋음 연비는좀떨어짐ㅜㅜㅜㅜㅜㅝㅓㅓㅑㅓㅓㅇ
2026 포르쉐 카이엔 E-하이브리드 쿠페,6.83,"모든 것을 평가할 때 가격 대비 가치를 생각하는 편. 그런 기준에서 주행성, 거주성, 연비는 중간. 디자인은 뛰어나고 품질은 아쉬움. 정비인프라는 미흡. 그러나 방패의 마력이 결국 다시 돌아가도 같은 선택을 하게 만들 것 같긴 함"
2026 포르쉐 카이엔 E-하이브리드 쿠페,7.17,"[단점] 1. 저속주행성 구림. 기아 1~4단 사이 바뀔때마다 꿀렁이는 문제가 있음 2. 순정네비 무쓸모 3. 서비스센터 A/S 끝내주게 오래기다려야함 (현재기준 예약후 3개월정도..) 4. 잔고장 많음. 특히 오일필터하우징누유, 냉각수누수는 고질병. PCM도 오락가락함 [장점] 1. 눈이 즐거울정도로 예쁜 차 2. 쩌는 하차감 3. 보증연장 15년까지 됨 (드럽게비싸긴하지만..)"
2026 포르쉐 카이엔 E-하이브리드 쿠페,7.83,"카이엔쿠페 노멀, 옵션 조율해서 딱 2억맞춰서 출고했구요. 빨리가고싶으면 빨리가고, 급하게 서야할때 잘서고, 몇달 타보니 탈때마다 내가 성공했구나 라고 느낍니다. 도로에서 스트레스 받을일 없고, 누구태우면 다들 대우가 틀려지고, 가성비도 그럭저럭 괜찮네요. 그러나 포르쉐 서비스센터는 형편없는게 ,이대로가면 레인지로버 꼴 날거 같습니다."
2026 포르쉐 카이엔 E-하이브리드 쿠페,8.83,디자인 승차감 너무 만족함 다만 가격이 비쌈 연비가 좋지 않고 서비스 받기가 쉽지 않음
2026 포르쉐 카이엔 E-하이브리드 쿠페,4.67,차보다 우선 포르쉐의 서비스가 형편없음. 앞으로 포르쉐는 절대 구매의사 없음.
2026 포르쉐 카이엔 E-하이브리드 쿠페,6.50,가성비가 부족함 서비스센터 대기기간도 상당하다 특별함도 그순간뿐이고 다음에는 절대안삼
2026 포르쉐 카이엔 E-하이브리드 쿠페,7.83,이가격대에 디자인 스포츠성 나쁘지않음 연비도 괜찮은편이고 만족도가 높네요
2026 포르쉐 카이엔 E-하이브리드 쿠페,6.67,많이 흔해졌지만 독3사보단 낫지않나...그냥 포르쉐라서 마크보고 탑니다.
2026 포르쉐 카이엔 E-하이브리드 쿠페,9.00,"에르메스는 에르메스이기 때문에 구매하는 것이지, 이것저것 하나하나 비교해보고 깔꺼면 국내 가죽 장인에게 수제가방을 의뢰해서 들고 다니시면 됩니다. 포르쉐는 포르쉐이기때문에 사는거라고 생각합니다"
2026 포르쉐 카이엔 E-하이브리드 쿠페,9.17,"2019년에 3세대 신형 미국에서 출고해서 현재 한국에 가져와서 5년 째 타고 있습니다. 제가 가속을 하지 않는 편이지만, 필요할 때 덩치에 비해 충분히 빠르게 반응해주고 잘 달려주는 것 같습니다. SUV라 그런지 뒷좌석이 좀 안락하다는 느낌은 없습니다. 디자인이 예뻐서 너무 맘에 들고 딸아이가 (나이가 같아서) 너무 사랑하는 차입니다."
2026 포르쉐 카이엔 E-하이브리드 쿠페,8.33,다 좋아요~ 차 점검 같은거 맡길때 시간이 오래 걸리는 빼면 대체로 좋은거 같아요~
2026 포르쉐 카이엔 E-하이브리드 쿠페,9.67,X5나 GLE 가격 다 올라서 카이엔 타는게 낫고ㅡ 걍 많이 팔리면 이유가 있음ㅡ 가성비 굿임
2026 포르쉐 카이엔 E-하이브리드 쿠페,10.00,아주좋습니다 독일 3사보다 나은 하차감에 성능도 괜찮아요 가격 살짝 비싼거빼곤 만족합니다
2026 포르쉐 카이엔 E-하이브리드 쿠페,9.83,그냥 좋습니다^^!!!!!!♡♡♡♡♡♡♡♡♡♡♡♡♡♡♡♡♡♡♡♡♡♡♡♡♡♡♡♡
2026 포르쉐 카이엔 E-하이브리드 쿠페,9.33,"어지간한 고성능 수입차들 x6m cp, gt43, g63 등등 운영해봤는데 왜 포르쉐라고 하는지 알겠어요 정말 좋아요"
2026 포르쉐 카이엔 E-하이브리드 쿠페,9.50,가성비 최고의 포르쉐는 카이엔 연비는 무난 무난 무조건 에어서스는 하시길… 안해서 후회준
2026 포르쉐 카이엔 E-하이브리드 쿠페,10.00,차 가격대비 뛰어난 성능을 발휘함. 가격대가 일억 중반대라 그런지 무상 제공되는 서비스가 없는게 아쉬웠습니다
2026 포르쉐 카이엔 E-하이브리드 쿠페,9.67,전기 충전기만 있다면 최고의 차입니다. 흔들림 없고 조용하면서 잘 달리고 잘 멈춥니다. 역시 기본에 충실한 포르쉐!!
2026 포르쉐 카이엔 E-하이브리드 쿠페,9.50,플러그인 하이브리드로 출력 정숙성 연비 스포츠 주행감성 모든면에서 우수합니다
2026 포르쉐 카이엔 E-하이브리드 쿠페,9.17,"1. 고질적인 에어서스문제 = 무상보증으로 무료. 2. 주행중 간간히 뜨는 사소한 경고등 = 주행중 나도모르게 사라지고 잘됨. 3. 람보르. 벤틀. 페라. 롤스 에 이어, 대충 자동차계의 10위권 안의 하차감의 느낌. 4. 나는 성공했다의 느낌. 5. 본인의 차 키를 자신있게 식당 테이블에 올릴 수 있는 자신감. 6. 고장시 포르쉐 긴급출동 서비스로 타사 차량 체험 가능. (동급은 아님) 7. 그냥 포르쉐."
2026 포르쉐 카이엔 E-하이브리드 쿠페,9.17,"이젠 흔히 볼수 있는 강남 산타페라지만, 그럼에도 가격대비 대체불가 스타일쉬한 펀 카입니다 . 데일리카로 사용하기 좋습니다."
2026 포르쉐 카이엔 E-하이브리드 쿠페,4.67,"suv 라서 험로주파를 위해서, ZF 8단 팁트로닉을 넣어놨는데, 엔진출력이 높으니 울컥거림이 꽤 있습니다. 고속주행시 안정적인 주행질감과 승차감은 아주 좋은데, 시내에서 가다서다를 반복하는 주행에서는 멀미가 날때가 있습니다"
2026 포르쉐 카이엔 E-하이브리드 쿠페,9.67,그간 여러대의 suv 타보면서 전체적으로 압도적인 성능이나 디자인이 아니더라도 엠블럼 하나로 그냥 멋짐
2026 포르쉐 카이엔 E-하이브리드 쿠페,9.33,역시 카이엔 최곱니다. 풀옵으로 사서 레인지로버랑 고민했는데 카이엔사길 잘했어여
2026 포르쉐 카이엔 E-하이브리드 쿠페,8.67,좀 비싼거랑 너무 전자식이 된거 특히 스마트 키 가 불편하지만 포르쉐 다운차
2026 포르쉐 카이엔 E-하이브리드 쿠페,9.17,시내 연비빼고는 대만족 고속도로에서는 그나마 연비 괜찮아요 감가상각도 좋아 중고가격 방어최고라 4년 타고 재구매합니다 포르쉐는 자주 바꾸는게 더 경제적이라니까요ㅎㅎ
2026 포르쉐 카이엔 E-하이브리드 쿠페,9.67,"생각보다 훌륭한 연비 덕분에, 데일리카로 유용하게 잘 타고 있습니다. 추천합니다."
2026 포르쉐 카이엔 E-하이브리드 쿠페,9.00,기대만큼의 suv는 아니였던것. 특히 사계절 타이어의 성능은 정말 별로다. 하지만 방패하나로 차값도 가치도 이미지도 우주방어다. 어찌보면 가장 저렴한 차. 감가가 정말 작다.
2026 포르쉐 카이엔 E-하이브리드 쿠페,9.67,"패밀리카였다가 스포츠카로 변신하고, 내연 엔진 사용하다 전기차로 주행하고, 만족도 최고!!!!"
2026 포르쉐 카이엔 E-하이브리드 쿠페,9.33,연비와 가성비로 타는 차는 아니니 그것제외하면 만점에 가까운 차입니다! 후회없는 선택입니다
2026 포르쉐 카이엔 E-하이브리드 쿠페,7.67,마크 아니면 솔직 안타요. 연료펌프 소음에 환장 합니다 개선 대면 모를까 솔직히 0점 짜리 입니다 개선 대면 10점
2026 포르쉐 카이엔 E-하이브리드 쿠페,10.00,"플러그인 하이브리드 카이엔 쿠페. 정숙성과 스포츠성, 연비까지 3박자 모두 갖춘 최고의 SUV. 전기로만 40키로 정도 주행가능하고 스플로 달리지 않는이상 하이브리드 모드로 복합연비 15키로 이상 나옴. 스플모드에서는 제원상 제로백인 5초대비 훨씬 빠른 4초 초반대로 왠만한 스포츠카보다 빠름. 1억 중후반대에서 승.하차감 비교시 대체가능한 차량이 없음. 단점은 출고 대기 기본 2년. 집밥 없음 비추. 주행에는 문제 없지만 자잘한 전자계통 PCM 오류가 가끔 생김."
